LCDS Mention,Link,Date Available Online,Type,Source,Name,Snippet
Experiencing heat during pregnancy results in fewer male babies: study - The Hindu,https://news.google.com/rss/articles/CBMiywFBVV95cUxPLU5xVHdGcjZiZ0txbXZhMENjY3pUa0tTeFNoLVVEQVJVOXZxZ0JzOFdTcENhOXE3eU5naG1acms2eWVMZUM1aG1kV2lMeWpGM3dxMFU5dHlQWjZGSThfSW9mWDdPWFNMbFBqdEhFa19FZU44a2puVzVzN0dkQmQ4ZG1TVld4a2w0WkphOUpxbm12cUpSeGduMWc1cktqMENvSWRiUVNuaS1mYkhnel82NGR3OGhRVkdFU1BUc0Q4NlVvLVJ5MXB1UF94ONIB0gFBVV95cUxOVUx3Rm9vbklkTXJfTGpOWElhSURyS1gtRnVsUlU4RjFkVGhNMFc4ZWpXMVl2U3E5UGl4X2pzdTBhckJCSW5yQW9fYWw4RnJBaC1fbFhmTFMyaXItbE1ZQmJuQUl3Ync4MFo5RmI2dHFucjNvQmdLSTZQVlh2aDF3QkFYNEhhUXZhR2ZTdUhrYlQ1ekt5eDM1OEowV21zbkcwcXdGTWVOUEVfb2ttamRlQnNmME5LbFhFMmlKOXRib0R0RlpnWVZvLVNTcnZHem9kcnc?oc=5,2026-03-06,Research Coverage,The Hindu,Jasmin Abdel Ghany,Experiencing heat during pregnancy results in fewer male babies: study    The Hindu
Weaponizing Kinship - Max-Planck-Gesellschaft zur Förderung der Wissenschaften,https://news.google.com/rss/articles/CBMidEFVX3lxTE9DU1NiVkVTaHNTZjNFbnIzNG1WNVA5SEtDclVQMDZzZkJ2Rnh4S2J2SXFPOWZxTjhnb29fa3NLSWVMamwwa0o1Q1BPUW1QSE1PRnhuRzM1TUE1ZFpyVGV3cVBYd1VYelotTGlWcjkyczZFZGNs?oc=5,2026-03-05,Research Coverage,Max-Planck-Gesellschaft zur Förderung der Wissenschaften,Maria Gargiulo,Weaponizing Kinship    Max-Planck-Gesellschaft zur Förderung der Wissenschaften
"Living Donor Donation Works When Relationships Matter With Mary Roberts, PhD - HCPLive",https://news.google.com/rss/articles/CBMiigFBVV95cUxQSHRlUFQyQmt2VUVJWGo0UUFseXd4cjFySkk4UGhOQWFvUWdabGh6Szl5TWxvSTdrZVliT1phLUM3M0dUaDhmSjBVaThjb3Y1M3IzWnpVUzA5VzRqdG5qak1Ya3VqQk5UYndtZ0U2TmR2ald4N1hTd2xHZGE2dHZVcEFSRDBZY3FGU3c?oc=5,2026-02-25,Research Coverage,HCPLive,Mary K. Roberts,"Living Donor Donation Works When Relationships Matter With Mary Roberts, PhD    HCPLive"
High temperatures linked to fewer male births in sub-Saharan Africa and India — Oxford study - radio47.fm,https://news.google.com/rss/articles/CBMixgFBVV95cUxNaGxHXzU2Sm9xbkdzVmMwOEtHUVpKQ1UtR2trdS1yWnJaQ1lWVUhKdjc1cnhWN0R1dFFJM0NMdncwa1BhQkRVRzZZaTgyLTdkRzdsazRGNl8xOHRUeUdfd3FzM0N3OF9tM1Z6d1I2U1ZiVkdXNDUzMXNMc2JtdGhWZ3psVHNucW03ZGlGeS1RdDc4d2pBVEFTcGdhanZ3SGVnTG1YOHdZMk1Jam5rTFU2ekNnSmZCckpfejBQRmNab1FKU0YzY2c?oc=5,2026-02-25,Radio,radio47.fm,Jasmin Abdel Ghany,High temperatures linked to fewer male births in sub-Saharan Africa and India — Oxford study    radio47.fm
Oxford research links heat exposure during pregnancy to decline in male births - Nairametrics,https://news.google.com/rss/articles/CBMitgFBVV95cUxOME5jOEZBVHJTaVRZT3F2WTdCbWwtUngyVWFkeGxTVHp5YzVRRzloWjE4VDRZM3p1dVp4RGJxT25FNHp4NVNLcEtfcTVlRkVrbVRZTnNLWVFpVE9YYTJqS1hsZUYzYlhiTDdoazl5RE9YdDhNSHhDQ3k2RHlYeG44SWtwSTVEVGRhdFN3d0YzdkpWXzZObVlDdk5yS0ZCaUtOZVlqMEJmMUcxRnI5LWhTakZYUTJ5dw?oc=5,2026-02-24,Research Coverage,Nairametrics,Jasmin Abdel Ghany,Oxford research links heat exposure during pregnancy to decline in male births    Nairametrics
New research shows high temperatures affect sex ratios at birth - University of Oxford,https://news.google.com/rss/articles/CBMingFBVV95cUxNOXpPUnZKQk1pcG5oamFNb2xiaGVJWlNCd0pNOVozWEM5SHgwVFc4OTFnRjRxVWlwMUZWOXpfQ2twY29UaGV3Y2h2dFNhWFBvVktFYTVObmNIX3RCTTEtMDI2YlNiUjJRV2lBeGl3a3VYYnFKakE4djhjRlFMTDcyNEVYem95UGdmaEwzUHVjNFdaeGtTY0NldXdITEFNUQ?oc=5,2026-02-23,Research Coverage,University of Oxford,Jasmin Abdel Ghany,New research shows high temperatures affect sex ratios at birth    University of Oxford
Economic History in 2025 - Economic History - The London School of Economics and Political Science,https://news.google.com/rss/articles/CBMiggFBVV95cUxPenU0bGgyaS1mdHFtbElxWVhJSmc4bG05aW9JSTFUX0U3ZEhOSUlnSGNpR083T2tJREdKdzllY3NFeEUxc01KV2pkcWRCazNTWHZQTERzaEd3cEctWnBqeHl0Znp6cTJfTlY1TlhUR0xzbVM4T2F5NDQycmdTTnp1Ql9n?oc=5,2026-02-20,Research Coverage,The London School of Economics and Political Science,Hampton Gaddy,Economic History in 2025 - Economic History    The London School of Economics and Political Science
January 2026 - Avian Flu Diary,https://news.google.com/rss/articles/CBMiUEFVX3lxTE5hb2NWWW1iVU9NUzdSX0VGWHRWQTFPT2RCUDM0ZmdCNFJENm5kV3pkTUNYSTNqWFZTLVJBckkxTTZDMDJlaHl1U3NQSDZvdk5j?oc=5,2026-01-31,Research Coverage,Avian Flu Diary,Thomas Rawson,January 2026    Avian Flu Diary
Nature: An Outbreak of HPAI H5N1 Could Impact the Dairy Cattle Sector and the Broader Economy in the United States - Avian Flu Diary,https://news.google.com/rss/articles/CBMihAFBVV95cUxObDhtRTlVbUprVXR2bjc4N2tlaXhsMUxxRW9tNHAyZXVoZXYzY1N4RDVmX0Y1NkRfNFdNNFQwRmFOYUJWZE9DaEtTOVpPeWVCV1lsV1I0aE9XcDQ0ZU1TeGlrMlRsZzg3MmJnVmFWNkFBN1ZUN0xUMklMbnl5YkZ4UGN4Mzg?oc=5,2026-01-31,Research Coverage,Avian Flu Diary,Thomas Rawson,Nature: An Outbreak of HPAI H5N1 Could Impact the Dairy Cattle Sector and the Broader Economy in the United States    Avian Flu Diary
An outbreak of highly pathogenic avian influenza H5N1 could impact the dairy cattle sector and the broader economy in the United States | Communications Earth & Environment - Nature,https://news.google.com/rss/articles/CBMiX0FVX3lxTFBFMEptM1diaWMxRzBUenBIdVNoeXFSckIzUlNkYm5NN0FiZF9TcUxIdXRHOU9QRUswQkw5N3VtSVFhSVQ1YVBycFF2cHAyNXVPLUJqcGNacnZMOGs5cWhj?oc=5,2026-01-27,Research Coverage,Nature,Thomas Rawson,An outbreak of highly pathogenic avian influenza H5N1 could impact the dairy cattle sector and the broader economy in the United States | Communications Earth & Environment    Nature
Meta-analysis reveals negative but highly variable impacts of invasive alien species across terrestrial insect orders - Nature,https://news.google.com/rss/articles/CBMiX0FVX3lxTFBFa3hvOVM2cVhXYXppd3B2NElzMmhpYzV5cE04REJVQmVrdE0zZjZWbHBoenVCLUhhNm8yQkt5LU04ZGNEbVpxNmlnRGVCc2xnMWsyN2hXd0hhclIyZlo4?oc=5,2026-01-15,Research Coverage,Nature,Joseph Millard,Meta-analysis reveals negative but highly variable impacts of invasive alien species across terrestrial insect orders    Nature
"Insects are victims, not just invaders, says study - Phys.org",https://news.google.com/rss/articles/CBMia0FVX3lxTFBEOEhOa1laSkUzY2RSTzdDLXZJUHd1YzE5VEdEVW03aDJickdOR2dXV0VYSldQWFY1X2M0ZzZWNnhZbUZhT0ZVUFRUUXVWaHE4eFBFOWFLMERzbVU2WWRVdkxwc01lZU5BTFBV?oc=5,2026-01-15,Research Coverage,Phys.org,Joseph Millard,"Insects are victims, not just invaders, says study    Phys.org"
Individuals whose phenotype deviates from genetic expectation defined by common variation are enriched for rare damaging variants in genes that cause rare disease - medRxiv.org,https://news.google.com/rss/articles/CBMifEFVX3lxTE9CSUc1czNXbjYtZXdXQTdXY0hxeVZTQnJUeDMzdXVQWmJpUExvQWVqd1E5aHkwY0FsU2dYS3JxSmxxZDdOTGJCdF90SDVRMHowQW1DZWdPc25FWlZpcFc1NUdtS0NUNFhsV0xPeHM3Tkxjd3VRSXFxN0FMc0s?oc=5,2025-12-31,Research Coverage,medRxiv.org,Cecilia Lindgren,Individuals whose phenotype deviates from genetic expectation defined by common variation are enriched for rare damaging variants in genes that cause rare disease    medRxiv.org
"Competition for heritable wealth, not cultural group selection, drives the evolution of monogamy - PNAS",https://news.google.com/rss/articles/CBMiXEFVX3lxTE9RR3M5WEtmZEM5WjlwU3R5c1ROcG1tODNIMmZpWlZyTG9mbFl3SGs2SFFGRmpIWTJsYW5xdkxYQlRnX2tRaThILTl2d0twa2UyTlRzak1TVGtqMjNw?oc=5,2025-12-30,Research Coverage,PNAS,Hampton Gaddy,"Competition for heritable wealth, not cultural group selection, drives the evolution of monogamy    PNAS"
Interactions with polygenic background impact quantitative traits in the UK Biobank - medRxiv.org,https://news.google.com/rss/articles/CBMie0FVX3lxTE9fVjFFM3BKNjlhVFp1aXJUUC0ySk9SdVRGUHdzTXc0bXJMNC11bWNiSlVTbHhSaVpxalpWUzBLQUtldURpLUdOSFVDSmV4V3N4WEZ3NEl4bGZmV0s3WXc4dUlwWUVVQTNRY1BpekxzUUdzeDJzYlRFZG5kQQ?oc=5,2025-11-17,Research Coverage,medRxiv.org,Simon Myers,Interactions with polygenic background impact quantitative traits in the UK Biobank    medRxiv.org
Demographic Research - Articles By Subject,https://www.demographic-research.org/articles/articlesbysubject/fertility,2025-10-29,Local/Web Mention,Deep Web Crawler,Haohao Lei,"Haohao Lei Volume: 53 Article ID: 29 Pages: 937-968 DOI: 10.4054/DemRes.2025.53.29 Abstract Full Text [PDF] 29 October 2025 | descriptive finding Early unintended childbearing and unsecured debt in the United States Clifford Ross, Mieke Thomeer, Joseph Wolfe, Shantay Williams Volume: 53 Article ID: 27 Pages: 897-914 DOI: 10.4054/DemRes.2025 ..."
Update air quality management to support meaningful public participation | Communications Earth & Environment - Nature,https://news.google.com/rss/articles/CBMiX0FVX3lxTE5oN2RscmhXM2VaSlY4amxJRDdfOHVoQkt6MWZzUTRCWFJ3VmptOExhR1E0T3FXX09IN0RIaVJrb3hsdDAxNGpjNzhkR2FsTktqby1UTlVGY2VEb1lHSW1v?oc=5,2025-10-27,Research Coverage,Nature,Kayla Schulte,Update air quality management to support meaningful public participation | Communications Earth & Environment    Nature
Rethinking polygamy—research upends conventional thinking about the advantages of monogamous marriage - Phys.org,https://news.google.com/rss/articles/CBMijgFBVV95cUxQS0lLQXlNcEYzRDNyTDNOVmVQRzh5RUU3c3d1OWlKMVhzTkRqQ25KSld6QVJNQXBJaUZVVFJnUGY4aGxNLXVRMWZranZ6QlhPRU5RTVdQalNFUU9mbG5nWVV1bzMwWHBfb000UXdUTzZkX1MyMHZqODFGWjdpakJlRXh5WWRNREk4a0QzTGRB?oc=5,2025-10-21,Research Coverage,Phys.org,Hampton Gaddy,Rethinking polygamy—research upends conventional thinking about the advantages of monogamous marriage    Phys.org
Realizing the full potential of Our Future Health through data linkage and trans-biobank efforts - Nature,https://news.google.com/rss/articles/CBMiX0FVX3lxTFA2cmFHQ01DQWdmT1RyQ1FKS0ZIOFVZb3VXUk03aExDYmphOVJzLVNKaXZJM3NDc2lnSlVOQ2pFWVpTNnpxNmUyWUhMLXQ0Qm92eUZwY2FMTkdMaHI5Wldn?oc=5,2025-09-15,Research Coverage,Nature,Augustine Kong,Realizing the full potential of Our Future Health through data linkage and trans-biobank efforts    Nature
"Parent-of-origin effects on complex traits in up to 236,781 individuals - Nature",https://news.google.com/rss/articles/CBMiX0FVX3lxTE5VMjlsXzJYaUxRY0lvRkt6c2tSbDNMcEV3amhrWHJBTUc0blRsRU9zblQ0d1hNNWRIQm1LeFI2TUhfMzZaT01VMWg1N1EweVRRM1JkLUNkVF9abzRqTWZJ?oc=5,2025-08-06,Research Coverage,Nature,Augustine Kong,"Parent-of-origin effects on complex traits in up to 236,781 individuals    Nature"
A mathematical model of H5N1 influenza transmission in US dairy cattle - Nature,https://news.google.com/rss/articles/CBMiX0FVX3lxTE5BSXBkd29OTDdIbXl4Nk5NY2ZCb1czSkljSWZ5WXUwUUEwLVM0blFDS3NScktSQlViX3RXSFlzRmx5WGI4azJZeVhTSjFqZnYteHhheldlNXNzaUdqWGQ0?oc=5,2025-05-08,Research Coverage,Nature,Thomas Rawson,A mathematical model of H5N1 influenza transmission in US dairy cattle    Nature
Dairy cows develop protective immunity against reinfection with bovine H5N1 influenza virus - Nature,https://news.google.com/rss/articles/CBMiX0FVX3lxTFBvcEtRN3pKU1hoQTVXQ0g0aGJDajQyeGdXNEU4WHRoRTJLTTVJYzZwVDJnTnVuUGt2Qlg3ZzBGaUFvbmptUDBRbkZxZ3oyN21Zdi1jT1dpTndSTVFpS1ow?oc=5,2025-04-17,Research Coverage,Nature,Thomas Rawson,Dairy cows develop protective immunity against reinfection with bovine H5N1 influenza virus    Nature
Volume 52 - Demographic Research,https://www.demographic-research.org/articles/volume/52,2025-04-09,Local/Web Mention,Deep Web Crawler,Hampton Gaddy,"Hampton Gaddy, Maria Gargiulo Volume: 52 Article ID: 23 Pages: 741-796 DOI: 10.4054/DemRes.2025.52.23 Abstract Full Text [PDF] 09 April 2025 | research article Uncovering what matters: Family life-course aspects and personal wealth in late working age Nicole Kapelle, Carla Rowold Volume: 52 Article ID: 22 Pages: 689-740 DOI: 10.4054/DemRes ..."
Air Pollution Policy and Governance - Nature,https://news.google.com/rss/articles/CBMiWEFVX3lxTE8xNi1mV3p4SW5WUWZpRnVQU3V1Q20zdTI4LTE2Q0NRNVFvX3B3bEVxTDhhVWNPY19RekJ6eEs4MlVRWUFPN1Q2MmxpYmNRZ0hVQzdSdzluWmI?oc=5,2024-05-20,Research Coverage,Nature,Kayla Schulte,Air Pollution Policy and Governance    Nature
Professor Max Roser - oxfordmartin.ox.ac.uk,https://news.google.com/rss/articles/CBMiX0FVX3lxTE1OWVhHWmkzUjdPZjRrcnFNT2Rudi10Slp6ajRpY0czWXVqeHFpM0lac1duMTNmRzV5QUVwaUxvX1AwS3pDenpHbnM3MkZRNUxxb2dPTnR6N1FZaE9NeHdv?oc=5,2024-05-07,Media Mention,oxfordmartin.ox.ac.uk,Max Roser,Professor Max Roser    oxfordmartin.ox.ac.uk
"GitHub - timriffe/DemoTools: Tools for the evaluation, adjustment, and ...",https://github.com/timriffe/DemoTools,2023-12-20,Local/Web Mention,Deep Web Crawler,Ilya Kashnitsky,"Date: 2023-12-20 DemoTools is an R package that contains simple functions often used in demographic analysis. It is in active development. This project is commissioned by the UN Population Division and financed by the Bill and Melinda Gates Foundation as part of the Making Family Planning Count project. Work is also done in collaboration with Sean Fennell, José Manuel Aburto, Ilya Kashnitsky ..."
Prof Amia Srinivasan and Prof Ridhi Kashyap win 2023 Philip Leverhulme prize - The Indian EYE,https://news.google.com/rss/articles/CBMiswFBVV95cUxNaU1zRFBST2Z1bGFvNWtIei14ZDVWOGpjS1BqcjVyZ3o3dkJBTE0zQklMZXpadWpIc0otTVZHVUZsdzFsVVI3Z1R3bXN5dE9UMUsxNmg4YjdKaXZOUF8zck5IaXdKRm9qVlN0VlZDd1QyZjlndU5aSmRkSG9Lbzdob1NxQ0FNWlNvMDFPQTliSWtnejZ6QVZGQ2YycTFGQTk2bUVzRTRrTUZnZGoxLVBFanh5Zw?oc=5,2023-10-27,Award,The Indian EYE,Ridhi Kashyap,Prof Amia Srinivasan and Prof Ridhi Kashyap win 2023 Philip Leverhulme prize    The Indian EYE
Demonstrating paths for unlocking the value of cloud genomics through cross cohort analysis - Nature,https://news.google.com/rss/articles/CBMiX0FVX3lxTE4tVUhBdVpwdkhWSVJOaVhKTUxfdUF6d3gwdzZuVlhXMjRHQ3dFM0hvOVVGN3pHS3hRcHhUT0JVV3p0dHk3YXdYTklTX1FoMjl2NWw2dGNqREV2ci1RLWlV?oc=5,2023-09-05,Research Coverage,Nature,Augustine Kong,Demonstrating paths for unlocking the value of cloud genomics through cross cohort analysis    Nature
Gene–environment correlations across geographic regions affect genome-wide association studies - Nature,https://news.google.com/rss/articles/CBMiX0FVX3lxTE1UZUFpbjNzWHpsd1QxaW4tM2NXbXJLY28yekJQaWU1Y1pnSmNMdFdLWlZReDViZUZFNlNJQ2Zxa0pDV0lKOHRpa1QxNzMzdXUyZ1VPbERiOFlCWVRfYzNr?oc=5,2022-08-22,Research Coverage,Nature,Augustine Kong,Gene–environment correlations across geographic regions affect genome-wide association studies    Nature
"PNAS Front Matter – Scientific News, Opinions, and Features - PNAS",https://news.google.com/rss/articles/CBMiSEFVX3lxTE5XSFZjR2xpblJfaW92RHYzV25YQU1nTlIyMEJiLXE0dHVVbXZOcG1OVUE5OE1SLWhkeDl4dUtkc0N4elpiTENLbA?oc=5,2022-02-28,Blog/Opinion,PNAS,Jasmin Abdel Ghany,"PNAS Front Matter – Scientific News, Opinions, and Features    PNAS"
Call me Spock - the dedicated and disruptive Melinda Mills takes a (quick) break - University of Oxford,https://news.google.com/rss/articles/CBMickFVX3lxTE5zR080aVpadzl6SjFvVzkwd1h6YVB6U2tNRW14NnlycXNNc0tHV3JlNHgyOE1ncDdEcmhiZkt4aE1Ya1ZURlZUVkUxSnVEbVI5NVBYNFBhX3dqcnEwMzBHcmF1NzltdGZmWmdsR3kxdzV3dw?oc=5,2021-06-14,Media Mention,University of Oxford,Melinda Mills,Call me Spock - the dedicated and disruptive Melinda Mills takes a (quick) break    University of Oxford
Global effects of land-use intensity on local pollinator biodiversity - Nature,https://news.google.com/rss/articles/CBMiX0FVX3lxTE5SSEZycGo0WEdwM18tdGhpV2hQZWNUOGk4Nm9sVS1zOE85ZmVSMUdvR2tFSURUa1dBWEx6Znc0Y1pFTjZjRmw4dkZiLTRLZ3RKY0t0SkNBX1JOd3hodExR?oc=5,2021-05-18,Research Coverage,Nature,Joseph Millard,Global effects of land-use intensity on local pollinator biodiversity    Nature
Diverse variola virus (smallpox) strains were widespread in northern Europe in the Viking Age - Science | AAAS,https://news.google.com/rss/articles/CBMiYEFVX3lxTE1IaU5yUVBKRXJoWXNfNHp0akZSZWZMd2dFX2FsNW90OThSWWs1UDNxekE5THYyVlk2LXR6cmVmeGY3cnQwLWRqeHQwZFhCZnVmMEl6TnVnRTdhcUlLZW9WYg?oc=5,2020-07-24,Research Coverage,Science | AAAS,Romola Davenport,Diverse variola virus (smallpox) strains were widespread in northern Europe in the Viking Age    Science | AAAS
Animal invaders threaten protected areas worldwide - Nature,https://news.google.com/rss/articles/CBMiX0FVX3lxTE1GQi1CT1cwNU5Zem5MZ2RSQXIwMHFWYlJhRHZRQ3BrbDdSN0p2SG1VdXFlck9mMGk2UHlpQ3RsM05WZGdRcXNTNS1xWGRjdzFNT3dqVng1NnFWLWE2MnA4?oc=5,2020-06-08,Research Coverage,Nature,Joseph Millard,Animal invaders threaten protected areas worldwide    Nature
The world map redrawn according to country populations (Credit: Max Roser for Our World in Data) - Devpolicy Blog from the Development Policy Centre,https://news.google.com/rss/articles/CBMi2wFBVV95cUxORzl5LUlobURleERHaHhjTEU2Q090UnpybUVMQnAxdHYyVXNyU3pNVlJweTlDbWZWbjg5N1RKUFpFaDBRMzNyc1U2NVczTmxQc1ZUY1gxSU1Xd2NGVjRtT2s0RmV2clVoUWk0VXNCRC1oS0I1Y3d3anM4SnZRUE93U2NPRlliMjE0cHBfTUtRMmxrLVlUX1pMRndxeWlFSEhya25VNkg4V3RJZGx2dVdwb3ZZdkRmbm9WQlBHRVlWbVFjNl9qbjE0YmxhYm5CU1Ric3d4a0J0TXlQYUE?oc=5,2019-09-27,Blog/Opinion,Devpolicy Blog from the Development Policy Centre,Max Roser,The world map redrawn according to country populations (Credit: Max Roser for Our World in Data)    Devpolicy Blog from the Development Policy Centre
Widespread losses of pollinating insects in Britain - Nature,https://news.google.com/rss/articles/CBMiX0FVX3lxTE5yU29TTUhCM28tSGxFR2xRTVh1VlplSGdxXzlVNnlKSmZTVUNuSUxVZWZUM1FSeGlQakdrdVhpX3VFbjI1dDczRUtPZUQ1b1NoZFJ5RlhVaHk3SVBlU3k0?oc=5,2019-03-26,Research Coverage,Nature,Joseph Millard,Widespread losses of pollinating insects in Britain    Nature
Finding hens in a haystack: Consistency of movement patterns within and across individual laying hens maintained in large groups - Nature,https://news.google.com/rss/articles/CBMiX0FVX3lxTFBQSVpvMmp5c2RpSHQwdm1Sd1N0VklfM1BndEUtOG56a2hWajFBNWhUQzVoQlh3QlRDNDQ0Wmd0M1lILUM3NXR1ajFLd3BLRy1MWEItTUhtYnpyWDMwRzE0?oc=5,2018-08-17,Research Coverage,Nature,Thomas Rawson,Finding hens in a haystack: Consistency of movement patterns within and across individual laying hens maintained in large groups    Nature
Invasive plants as potential food resource for native pollinators: A case study with two invasive species and a generalist bumble bee - Nature,https://news.google.com/rss/articles/CBMiX0FVX3lxTE90VVdTQkxzbFE5T2g3WHczeXoyMDJoaGRCR2pYTHV1YTE5bXZ1dTBjajlzcGZkazJBal8yekdHbnp2Y2ZBUUxrUnk0bGliY3F4dHRyZ1dtMUtpUTEwZVpj?oc=5,2017-11-24,Research Coverage,Nature,Joseph Millard,Invasive plants as potential food resource for native pollinators: A case study with two invasive species and a generalist bumble bee    Nature
Taxonomic bias in biodiversity data and societal preferences - Nature,https://news.google.com/rss/articles/CBMiX0FVX3lxTFA4SVl0SjVIUEtIcUVpZ19IR2prdmQ3S1lEYXltNnl2TGFEMGdyZkhNRldQMDBmREQwSTJ1aHk3ZjEtSVp5RzVPd2l3aEoyODJ2Ym0tQ1ctaXJzRnBONFZZ?oc=5,2017-08-22,Research Coverage,Nature,Joseph Millard,Taxonomic bias in biodiversity data and societal preferences    Nature
WOMEN'S FOOTBALL: Estonia ace Hannaliis Jaadla out to make her mark at Oxford United - Oxford Mail,https://news.google.com/rss/articles/CBMiswFBVV95cUxQanU3a01LVUJvMFR1N1ZIR0NCb3FhdmN3LWFKX2c4b1l6VmtlOXdWRWx2UEJ0eFFjcmxVVnRkNDB3MzdWOTNuVUl5Z3dEVzFsLVdBNkpUaTlEbDVHaFhzUFowRVVKNHF1NXJqSjlmZUNDQTZLQXdYZFJoMHFVOVVRTVNsbVllTXF4U1JqMDVhMXpzUGlONkloN054V1RCMlJJXzRvZE5laXRHamFoZXlDZVFlMA?oc=5,2015-03-18,Media Mention,Oxford Mail,Hannaliis Jaadla,WOMEN'S FOOTBALL: Estonia ace Hannaliis Jaadla out to make her mark at Oxford United    Oxford Mail
Hannaliis Jaadla: Oxford United Women sign Estonia defender - BBC,https://news.google.com/rss/articles/CBMiWEFVX3lxTFAzNW1nU1FEY1VSclJZeHBDVWxPeGRnWGlVamVFcHI5c0FKOUlpNDlhOEZHVkZ0bEU4Qk5BSDN0V0QzUTJFWm9ucUFTdkowQ01pU3M4OFhYc2E?oc=5,2015-03-18,Media Mention,BBC,Hannaliis Jaadla,Hannaliis Jaadla: Oxford United Women sign Estonia defender    BBC
Lifetime achievement award for Sir David Hendry - University of Oxford,https://news.google.com/rss/articles/CBMihwFBVV95cUxNTlVvclR1aEhpS25FNG1kejRtajl3c1cwcXBKdXVVdW1jS3ZJU0Z3Yncya190WjAtYkNlYXVrSWhRblhPQ3gtTDBGdUVaLW52Umt4aHZ5WVEzR2dMZ3dSQW9kN1M0N0owT3p5SmFreGh4dXpRSVNialU3LXFrWXVZQ09ZbzFzUW8?oc=5,2014-06-06,Award,University of Oxford,Sir David Hendry,Lifetime achievement award for Sir David Hendry    University of Oxford
Abnormal sex ratios in human populations: Causes and consequences - PNAS,https://news.google.com/rss/articles/CBMiXEFVX3lxTE0wUVBUNEJHQUlKb0xlRFVIT3p6WnZTbzBGZHY0amY4WHl3SEswVU5ULUJIbDJPYTNrRHdUWFRuUFRrRnp3bnhxUC1KX1FfdWY0RUhuVmRLaWZSejly?oc=5,2006-09-05,Research Coverage,PNAS,Jasmin Abdel Ghany,Abnormal sex ratios in human populations: Causes and consequences    PNAS
The Long-Term Effects of Exposure to Low Doses of Lead in Childhood — An 11-Year Follow-up Report - The New England Journal of Medicine,https://news.google.com/rss/articles/CBMiaEFVX3lxTE1Sb1NRMG9RbTdiYlNyWWppVEt5dWdPaVVIVVRZaWxmWG5lZVdWLUp4cEQ4NEhlZWg3OG5rQUtGTFFlV2lCTmFnUUNDZTAtM2NTdDgya3ZvRnNRYmNFNzVHLTFydTduOGZT?oc=5,1990-01-11,Research Coverage,The New England Journal of Medicine,Charles Lanfear,The Long-Term Effects of Exposure to Low Doses of Lead in Childhood — An 11-Year Follow-up Report    The New England Journal of Medicine
Population Change in Britain Since C19th with Professor Alice Reid - RGS,https://www.rgs.org/schools/resources-for-schools/population-change-in-britain-since-c19th-with-professor-alice-reid,,Local/Web Mention,Deep Web Crawler,Alice Reid,"Professor Alice Reid is a historical demographer, working on fertility, mortality and health in the late nineteenth and early twentieth centuries. She joins us to talk about reasons why these factors affected changes in population in the UK at this time."
Congratulations to the Class of 2023! - The Bernard and Anne Spitzer ...,https://ssa.ccny.cuny.edu/blog/2023/06/15/congratulations-to-the-class-of-2023/,,Award,Deep Web Crawler,Casey Breen,Program Award for Design Excellence Casey Breen Program Award for Ecological Excellence Mathew Brown Velasquez Matthew Garczynski Hollander Design Fellowship Multiyear fellowship to encourage and support New York City students from demographics and communities that are historically underrepresented in landscape architecture to pursue the field.
Cecilia Lindgren — Oxford Global Health,https://www.globalhealth.ox.ac.uk/our-researchers/celi,,Local/Web Mention,Deep Web Crawler,Cecilia Lindgren,"MSc, PhD Cecilia Lindgren - Professor of Genomic Endocrinology & Metabolism, Nuffield Department of Population Health"
Professor Cecilia Lindgren | The Academy of Medical Sciences,https://acmedsci.ac.uk/fellows/fellows-directory/ordinary-fellows/fellow/Cecilia%20Margareta-Lindgren-0033z000031YWzqAAG,,Local/Web Mention,Deep Web Crawler,Cecilia Lindgren,"Cecilia Lindgren is Director of the Oxford Big Data Institute and has made pioneering work in the field of obesity and reproductive disease genetics. She is a world leader in the field of metabolic disease genetics, with a career focusing on the genetics of some of the world's most debilitating common diseases. She has led seminal studies in diabetes, and has led international efforts ..."
Sociological Science,https://sociologicalscience.com/,,Local/Web Mention,Deep Web Crawler,Ginevra Floridi,"Ramina Sotoudeh: Department of Sociology, Yale University and Department of Political and Social Sciences, European University Institute. Ginevra Floridi: School of Social and Political Science, University of Edinburgh. Acknowledgments: We acknowledge funding from British Academy/Leverhulme Small Research Grant SRG2324\240432."
Population at LSE - LSE,https://www.lse.ac.uk/Methodology/Research/POP-at-LSE,,Local/Web Mention,Deep Web Crawler,Ginevra Floridi,Dr Ginevra Floridi Intergenerational transfers and productive ageing in a cross-national comparative perspective.
About me - Hampton Gaddy,https://hggaddy.github.io/,,Local/Web Mention,Deep Web Crawler,Hampton Gaddy,"Further afield, I am involved in the community of demographers spread across the university and beyond, serving on the Board of the Association of Young Historical Demographers and the EU-funded GreatLeap project. Before landing at LSE, I completed a MPhil in Demography at Nuffield College, University of Oxford."
Study reveals new insights on what caused the 1920 baby boom,https://www.ox.ac.uk/news/2023-04-06-study-reveals-new-insights-what-caused-1920-baby-boom,,Local/Web Mention,Deep Web Crawler,Hampton Gaddy,"Hampton Gaddy. Image credit: Nuffield College and David Fisher. Historical demographers have thought that the 1918 influenza pandemic caused a baby bust in 1919 and then a baby boom in 1920, as birth rates recovered. This was mainly based on evidence from Norway and other European countries that were neutral in World War I."
March 2021 - Retraction Watch,https://retractionwatch.com/2021/03/,,Local/Web Mention,Deep Web Crawler,Hampton Gaddy,"An Elsevier journal has retracted more than two dozen Covid-19 papers by a researcher in Malta with a fondness for Star Trek after determining that the articles did not meet its standards for publication. The move comes several months after we reported that Hampton Gaddy, a student at the University of Oxford, had raised questions about more than 100 articles written by a pediatric ..."
PDF Jiaxin Shi - Center for Demography of Health and Aging,https://cdha.wisc.edu/wp-content/uploads/sites/873/2024/03/Jiaxin-Shi-CV-09.2023.pdf,,Conference,Deep Web Crawler,Jiaxin Shi,"Session Chair, Population Association of American Annual Meeting 2023 Organizing committee, Human Welfare Conference 2021, Green Templeton College, University of Oxford Organizing committee, Rostock Retreat 2021 on Visualizing Uncertainty, Max Planck Institute for Demographic Research Ad hoc reviewer: American Journal of Preventive Medicine, Biodemography and Social Biology, Demographic ..."
PDF Jiaxin Shi,https://sosc.hkust.edu.hk/sites/default/files/2025-09/Jiaxin%20Shi%20CV_202509.pdf,,Local/Web Mention,Deep Web Crawler,Jiaxin Shi,"Affiliate, Center for Demography of Health and Aging, University of Wisconsin-Madison Guest researcher, Demography Unit, Stockholm University DPhil student, Leverhulme Centre for Demographic Science, University of Oxford"
