LCDS Mention,Summary,Link,Date Available Online,Type,Source,Name,Year
Teacher crochets her class of 30 as end of year gift - Oxford Mail,Teacher crochets her class of 30 as end of year gift  Oxford Mail,https://news.google.com/rss/articles/CBMikAFBVV95cUxNek9ESGFLN241QXphTkNUb1d4NUE4dHhyQ2lBbG9XZS1WczVOZHQ3MnRJWnJsc0ZLaW1uZHdPMGFVS1V3QkkxcnBMWGpEaFNuY01tVkQtMW1TWlFOWjBxRTlvaTdWOGFFMkZ3aGpMaG1zSDlTMnEtQmNYYW44bk1DQkQxd3BVVDdScFVERUNrMXc?oc=5,2024-07-23,Media Mention,Google News,LCDS General,2024
Shorter life expectancy during COVID-19 for India’s marginalised - University of Oxford,Shorter life expectancy during COVID-19 for India’s marginalised  University of Oxford,https://news.google.com/rss/articles/CBMingFBVV95cUxPS0U3SEEtU0RCQmVPcndaa2NndVQ2UjFMNGN4OUxldkxCbVA5WFhsZTZQcmtVQzNLMmJndGJITVRyQ2FBRUZMOWtIZk13Q0Fwc2VIV1p3Zkh5SmI3TVRnZHdGQm15TGtRZ3F3RWxNWi15YTVsZkVnZUR1UEpfNW5zRkMtMGZUV0xWTzhGUnV2OU5rRWxjLWlJeFpyQUpLZw?oc=5,2024-07-20,Media Mention,Google News,Aashish Gupta,2024
New Study Shows Life Expectancy At Birth Shrunk By 2.6 Years In 2020 - Indiaspend,New Study Shows Life Expectancy At Birth Shrunk By 2.6 Years In 2020  Indiaspend,https://news.google.com/rss/articles/CBMiwAFBVV95cUxQcmk0eENfZ3UycUwxTTQtYmtZRktZS3NXeGNIQkEtR2diNDhteWxOd0FNTEJXRjJtOGt4M21hMHhIcllTLUgyZFoxY2VJc3c1Q2V1TnVNZm1KaWtweDRtQ3IxZXdDOGc3UTFTMWZYVG5SV1UxT3g3dFpjZ284ZUpsM1B5NlJRSjh5Z0JZXzVWVmZ1cy1keUkxUEtJeXZFV0xmZk9XelpZMHFXTnRnT1E4YjdqTTBmTWFRWElJWjRzdTg?oc=5,2024-07-20,Media Mention,Google News,Aashish Gupta,2024
Mention in Newsfeed,Paper discussed on newsfeed.,https://www.news-medical.net/news/20240719/Life-expectancy-in-India-suffered-large-and-unequal-declines-during-COVID-19-pandemic.aspx,2024-07-20,Impact / Social,Crossref (newsfeed),Aashish Gupta,2024
Mention in Newsfeed,Paper discussed on newsfeed.,https://phys.org/news/2024-07-international-highlights-large-unequal-life.html,2024-07-19,Impact / Social,Crossref (newsfeed),Aashish Gupta,2024
Mention in Newsfeed,Paper discussed on newsfeed.,https://www.newscientist.com/article/2440364-covid-19-hit-women-harder-than-men-in-india-unlike-most-of-the-world/,2024-07-19,Impact / Social,Crossref (newsfeed),Aashish Gupta,2024
Life expectancy in India suffered large and unequal declines during COVID-19 pandemic,"The international study, co-authored by the Department of Sociology and the Leverhulme Centre for Demographic Science's Dr Aashish Gupta and Professor Ridhi Kashyap, reveals that life expectancy in ...",http://www.bing.com/news/apiclick.aspx?ref=FexRss&aid=&tid=69a8a5e0d68c4b30988f74f3e3c9a7af&url=https%3a%2f%2fwww.news-medical.net%2fnews%2f20240719%2fLife-expectancy-in-India-suffered-large-and-unequal-declines-during-COVID-19-pandemic.aspx&c=8594462625508889047&mkt=en-us,2024-07-18,Media Mention,Bing News,Aashish Gupta,2024
Large and unequal life expectancy declines in India during COVID-19,"The international study, co-authored by the Department of Sociology and the Leverhulme Centre for Demographic Science’s Dr Aashish Gupta and Professor Ridhi Kashyap, reveals that life expectancy in ...",http://www.bing.com/news/apiclick.aspx?ref=FexRss&aid=&tid=69a8a5e0d68c4b30988f74f3e3c9a7af&url=https%3a%2f%2fwww.eurekalert.org%2fnews-releases%2f1051694&c=544769326381598650&mkt=en-us,2024-07-18,Media Mention,Bing News,Aashish Gupta,2024
New bus ticket offers unlimited travel in Oxfordshire - Oxford Mail,New bus ticket offers unlimited travel in Oxfordshire  Oxford Mail,https://news.google.com/rss/articles/CBMilwFBVV95cUxPU253d3JiTnJ1Z29uamtPdDFDV3ZsMGZUNHpJWGtWN3dtd2lYbC1TelNfenVWX1RHN2l3T3BuVmgwazd3NkU2c1RSNFBwVzd4VWxLTVRscW5OVVpoUGtjTWl1UzM2Tk5kZWFrUVYza1ktTTJNVkpCM1dDeEVEczZhX2lfMTYwZm5rQVpQdDhfakxaMVpOSWxz?oc=5,2024-07-15,Media Mention,Google News,LCDS General,2024
The Persistence of Hypergamy - Population Council,The Persistence of Hypergamy  Population Council,https://news.google.com/rss/articles/CBMibEFVX3lxTE9HcTRJeFVOdFZiOUpIX3BQcEY2VVdXZndsZ0F0YmlqX2ZXczVjVGdtUm5zM2RnbnpBX0cweG9qOUNHVGlTaDYzbkowQ3VyVzZ2UjdJQjZIcS1JcjFVemMwV09OclY2TThJNFVQYg?oc=5,2024-07-10,Media (via Paper),Google News,Daniela Urbina,2024
The Persistence of Hypergamy - Population Council,The Persistence of Hypergamy  Population Council,https://news.google.com/rss/articles/CBMibEFVX3lxTE9HcTRJeFVOdFZiOUpIX3BQcEY2VVdXZndsZ0F0YmlqX2ZXczVjVGdtUm5zM2RnbnpBX0cweG9qOUNHVGlTaDYzbkowQ3VyVzZ2UjdJQjZIcS1JcjFVemMwV09OclY2TThJNFVQYg?oc=5,2024-07-10,Media Mention,Google News,Daniela Urbina,2024
Prediction of changes in war-induced population and CO - Nature,Prediction of changes in war-induced population and CO  Nature,https://news.google.com/rss/articles/CBMiX0FVX3lxTE5ORFNYejk5MkJsYnRJSEpLRU9IUjNZX3laLUtHWF9VUS15UTg2T0RtNTZvLWNGOUxWXzQ3X1hJRkNjLVNsaVNLOFBVQ08yWEJ1eVJTdU1lcnR5X0FYTFRn?oc=5,2024-07-05,Media (via Paper),Google News,Ben Elbers,2024
Using Facebook advertising data to describe the socio-economic situation of Syrian refugees in Lebanon - Frontiers,Using Facebook advertising data to describe the socio-economic situation of Syrian refugees in Lebanon  Frontiers,https://news.google.com/rss/articles/CBMijwFBVV95cUxQSC1jYWhWRW8tRnZaekwwWDZwSzR1NGxPcER3LXpxcG1vaUU2bXVWWnN3ejBrZ0RVVzNuOGtlMndPcmxGS3NmcDVQTW54NUFDdTFQcTF4SmMxQ1pBUjJsaElxREl0VTVFdkY2TklvNjIzM3UxaWo1WDA2WjA1ZEpidkFqR0M1WXBzUFZiOVN3Yw?oc=5,2024-06-26,Media (via Paper),Google News,Ben Elbers,2024
AI-assisted diplomatic decision-making during crises—Challenges and opportunities - Frontiers,AI-assisted diplomatic decision-making during crises—Challenges and opportunities  Frontiers,https://news.google.com/rss/articles/CBMijwFBVV95cUxQNnJNNWNEVjhrMXNPVFlVMlc5YWZXTVdQT0REbVFyaXZkYU9MWTZXYW5EUVdpci1VdWI2cnZ5U2drWU5ESTUxeVlxNk5NRlJNeDJfSVZNaWx1RWdKaHBESmo4bGcyMXMtN0w0NzdreGxhZFZ2WlcwbnBnNHc0MUp1NFkxMF81N2g2T21VazF2VQ?oc=5,2024-06-25,Media (via Paper),Google News,Ben Elbers,2024
"A deep catalogue of protein-coding variation in 983,578 individuals - Nature","A deep catalogue of protein-coding variation in 983,578 individuals  Nature",https://news.google.com/rss/articles/CBMiX0FVX3lxTFB4Vm4tSFkxVE02dXV2RXZkbVFMX2RackVkY0VBYy12SGZDNjJpX3JSdmxzUG9LZFF5V25RNnZFZDFNUzB1eWRBVnptSEtOMW5lbnZsdXlQTVhUbGM5ZkN3?oc=5,2024-05-20,Media (via Paper),Google News,Simon Myers,2024
Best practices for government agencies to publish data: lessons from COVID-19 - oxfordmartin.ox.ac.uk,Best practices for government agencies to publish data: lessons from COVID-19  oxfordmartin.ox.ac.uk,https://news.google.com/rss/articles/CBMiwAFBVV95cUxNMzBmZjBsZGFQZWtDV0lLVDNOYUdvYjkzUlVfMVF0YXVsNm82MzFyZnZQSDhrRnRhSFR4dlNrYkllOVJzS1FNbnlTYnpJQnVId2NVZ0E4YlNZYWR4bGtoT0V4SmR5QWlNeGt1VXZDal9oWjVzaXZYMDlXWjZ5cFBtMllVUnFSaFY2UmN6Z0RQdzBqM18yODBUZndYRU0xczUtWDdRNWFaYktDaUxCQ2ZRVGdLZUZBNTBEZUN3QmE0MEo?oc=5,2024-05-07,Media (via Paper),Google News,Max Roser,2024
Research key before buying: sharemilker - Otago Daily Times,Research key before buying: sharemilker  Otago Daily Times,https://news.google.com/rss/articles/CBMiekFVX3lxTE54N2t4dDZvWjJCTFlwcnlramRwR3FCUGM2LTVaaF8zN0hnWWE4V3o3Vm14ZjYyMzMyb1l5WVVtZ3lXTl9LRERjREd6OWVvN2dlMlc5R0xEbnk5d3hiRklJdFRYWTVTWFpLT3NtWW1WbXhCdlRRdmc3SXBR?oc=5,2024-04-17,Media Mention,Google News,Alice Reid,2024
Clothing company owner avoids jail after strangling ex-partner - Oxford Mail,Clothing company owner avoids jail after strangling ex-partner  Oxford Mail,https://news.google.com/rss/articles/CBMilAFBVV95cUxNcEQ3eUhQX043NHd4blNhWjVEcGFkb3gtcDFVTkE2ZGlDLUN2ZVBqODYzRjdJbklEdkc5REhqbmhZU0tsUWpqZjAyVG9zazEtVm9IdFJTWlpNbGdqUmFudnFDUkwydTZDMllKZldWY0EtY2IyV1Uxbk1yeTJzS3BpWlpVNnpsc19PQUJ5aERLRkdiWXVv?oc=5,2024-03-26,Media Mention,Google News,LCDS General,2024
New study highlights troubling trends in midlife mortality in the US and UK - University of Oxford,New study highlights troubling trends in midlife mortality in the US and UK  University of Oxford,https://news.google.com/rss/articles/CBMipAFBVV95cUxObXZ3WmYwV2hsVFg1S3hZa0k4ZHNsQmhiOEhGVmF6SGUxVHRuRzM5TWdiRXBNM0x5dUlPTWZjTm10VC04cmE3V0dSdVpNWkZTdG04bUVtby1OV004LXVha0ZHdXVCakwyZ0tOb25oSm5DTVJzekdfQzdEQWhVVVAzUThsTU9PUjk1NmdTR2t4YnZ6X3JXS2h5UEZVenRMVE5qZGNDeQ?oc=5,2024-03-21,Media Mention,Google News,Katarzyna Doniec,2024
Endometriosis: What’s the Latest Research? - Technology Networks,Endometriosis: What’s the Latest Research?  Technology Networks,https://news.google.com/rss/articles/CBMimwFBVV95cUxOS3RyaTltaHBhWThxci1EdUhTczF6a1FhcGhLOERtNHVSXzVDeEFQTjQxLTZDRFlQbGRhczZMa2NpZ3p3WlpkZXplQzlodmZsUmtHeVRHaks3SmpvVVFIQ3dud1pvMTJteGx5eVd0YkdGcndBSThJRGtVYXBZNGlLYUZINjFKeEdIYWFPcjVIQzJGdW1aVTY1SEV5SQ?oc=5,2024-03-19,Media (via Paper),Google News,Cecilia Lindgren,2024
Projecting the long-term effects of the COVID-19 pandemic on U.S. population structure - Nature,Projecting the long-term effects of the COVID-19 pandemic on U.S. population structure  Nature,https://news.google.com/rss/articles/CBMiX0FVX3lxTE8ybFBaa0hPcWhvWUNQZGpIX1I0TkNCTnZXOGJwTm9adGhOSDdISVVVcVdnY0ZKZWJSR1dvc0NXM1NBT3FiQ2lZdkw3LWhPa2pFWTNveWs0MUJ5MGdRSDRB?oc=5,2024-03-18,Media Mention,Google News,Antonino Polizzi,2024
Used Cars From the UK Pollute More Abroad Than at Home - AZoCleantech,Used Cars From the UK Pollute More Abroad Than at Home  AZoCleantech,https://news.google.com/rss/articles/CBMiYEFVX3lxTE9GRkxJVS1DS1ZFeUhZdkZ5b1ZrMzBoVGllRXVLR0pvd1BUS1poNzNoZ2J4TTU1Q3hOX1pvaW03ZTRmOHNGNl9heTlpREtWSWNPWTFEMHdhM095U2FlTUNjcA?oc=5,2024-02-21,Media (via Paper),Google News,Kayla Schulte,2024
Offshoring emissions through used vehicle exports - Nature,Offshoring emissions through used vehicle exports  Nature,https://news.google.com/rss/articles/CBMiX0FVX3lxTE9KMHBoUWVhOVJyem9UMzJ5cmtqYkh4aERld1ZiRGhxSnBRZVpIZkJKZ21PZWs1djVqdWlyMG1VTURCUDNJazJ2SlVsaTMwV0FBSFRWZ3A4SXQ1bUlOSXRj?oc=5,2024-02-20,Media (via Paper),Google News,Kayla Schulte,2024
Study shows UK offshores emissions through used vehicle exports - University of Oxford,Study shows UK offshores emissions through used vehicle exports  University of Oxford,https://news.google.com/rss/articles/CBMiogFBVV95cUxOSnBZMDVkQTFGRzFON2lYRmNBYjNlZjFrQlZsbEJlUk5KN0tnaTVFekxfcnF4dS1GT3NXNC1MeUNKcEp1MnBXN3dPTnFhWnkyUjlzVGJNTlhVaERUa1oyVkpQOWpjaGRQUWZTOEVuWElzRVZpb1lNbHAzM2kyUXFnOE5Rb3lWeGJlNmI3aUhQYk84RDJwb0t4U05yR3N2ZklRM3c?oc=5,2024-02-20,Media (via Paper),Google News,Kayla Schulte,2024
Genetic determinants of micronucleus formation in vivo - Nature,Genetic determinants of micronucleus formation in vivo  Nature,https://news.google.com/rss/articles/CBMiX0FVX3lxTFAyeFpadDgxTk1OTWIwYzFuc0xQU09ITU54UFNlZmhIODBjVTk3eDlQU1BHckFpOVdKVGQ2MDhFRUdFTUVUN1BPNWZ6VmZGUHd2Sy12d21ONjU0RlVmU1pV?oc=5,2024-02-14,Media (via Paper),Google News,David Brazel,2024
A study on the evolution of tripartite collaborative prevention and control under public health emergencies using COVID-19 as an example - Nature,A study on the evolution of tripartite collaborative prevention and control under public health emergencies using COVID-19 as an example  Nature,https://news.google.com/rss/articles/CBMiX0FVX3lxTE9zLW12QzREblF3VnZlajF1N3B0SHJjdW80NnhTVkxJbVNYaVpsV1BpQldvTUtGOTJZQkdKdzEwWU9GWUV0TnFJSFc0UDFidF9zd2toeTNuLUt5eXZEeDJv?oc=5,2024-02-07,Media Mention,Google News,Mingyue Liu,2024
American Journal of Hematology | Blood Research Journal - Wiley Online Library,American Journal of Hematology | Blood Research Journal  Wiley Online Library,https://news.google.com/rss/articles/CBMiaEFVX3lxTE42Q3A4QzZQQ1E5RmJBRUU2SjRaVHplcWZobUwxUThLWVFLM0FjTkNpeVVNRUIwLXRHVUlhYl8zQTBZQ0I2Sjhaenl1ZkRKSHMxNHVTakdYVFl4MWFhUERKVEpldXBaR3JL?oc=5,2024-02-06,Media Mention,Google News,Mingyue Liu,2024
The impact of reproductive factors on the metabolic profile of females from menarche to menopause - Nature,The impact of reproductive factors on the metabolic profile of females from menarche to menopause  Nature,https://news.google.com/rss/articles/CBMiX0FVX3lxTE1LZ0FfZlBUZXQzM1hnd1NoeFRpVWRSRGdzWHdkN3EtNnQxNGVjUWFRd01RejM0THFsdU1iMzNBQ3pwdnlZTW5aUGU4QU56NTBJcW9SWktLZm5Bay1uakJn?oc=5,2024-02-06,Media (via Paper),Google News,David Brazel,2024
Increase in drug-related deaths recorded in Oxford - Oxford Mail,Increase in drug-related deaths recorded in Oxford  Oxford Mail,https://news.google.com/rss/articles/CBMikwFBVV95cUxNWTRxUGtPRW9aLUhMNU5WVTVScHNuX0ZadlQ0WVJnX3kxWnpjYmJ3U2ZqLWZzZmdqZzlNc05SdXZUVEt4a2Vva2NUUU5qYUZ0WDI0SS1mLWNGV0RJQ0FrQVI2XzJvS1U2UlVET0tDY1dGSS1LT3YtX2dqel9YdWJUaE56S09rT1Z1RVdqVndkemtNWjA?oc=5,2023-12-22,Media Mention,Google News,LCDS General,2023
Mention in Wikipedia,Paper discussed on wikipedia.,https://en.wikipedia.org/wiki/2023_in_science,2023-12-17,Impact / Social,Crossref (wikipedia),Joseph Millard,2023
10 fun photos of Oxford’s historic Covered Market - Oxford Mail,10 fun photos of Oxford’s historic Covered Market  Oxford Mail,https://news.google.com/rss/articles/CBMikgFBVV95cUxNaWtINjRZaUsxbDllSUNQblpkS2loT1ZBZnhibDVtOXBZb0p5VUYxT1p2eWppVTAtWXhnSld0SU0yd2JaQUNDdWQ5cDdQdHNJTHZISURFY0pza19QLTV3dUdLSkE5dGxPOC1RSjZib0ZNMTNFamtYZWc3LTFsbTZqTFdQQ0pGcldyQkVtQ2dfV25uZw?oc=5,2023-12-09,Media Mention,Google News,LCDS General,2023
CenSoc: Public Linked Administrative Mortality Records for Individual-level Research - Nature,CenSoc: Public Linked Administrative Mortality Records for Individual-level Research  Nature,https://news.google.com/rss/articles/CBMiX0FVX3lxTE1uQUVQdXRNVkpIZExIT0FfZUdwTlFDUlFyUnR1bExVWm1mWXZ2TC1wRHhnUUJha0dHTHR2ZndyNk9pOXJJc3haOWdBbFJXN2FBdy05MlRVWHpKR3JqVEs0?oc=5,2023-11-15,Media Mention,Google News,Casey Breen,2023
CenSoc: Public Linked Administrative Mortality Records for Individual-level Research - Nature,CenSoc: Public Linked Administrative Mortality Records for Individual-level Research  Nature,https://news.google.com/rss/articles/CBMiX0FVX3lxTE1uQUVQdXRNVkpIZExIT0FfZUdwTlFDUlFyUnR1bExVWm1mWXZ2TC1wRHhnUUJha0dHTHR2ZndyNk9pOXJJc3haOWdBbFJXN2FBdy05MlRVWHpKR3JqVEs0?oc=5,2023-11-15,Media (via Paper),Google News,Casey Breen,2023
The 18 firework displays on in Oxfordshire for Bonfire Night 2023 - Oxford Mail,The 18 firework displays on in Oxfordshire for Bonfire Night 2023  Oxford Mail,https://news.google.com/rss/articles/CBMiogFBVV95cUxNb0o0QTk4ejREUjJxOEM0VmRVdmdvRnpWUHhxYzlOQlRqeXNlckx4eFJPMnBfSzVSNTE3QzFlTFczbUN5V0thVTlCMHNYV2RrZ2NQREh5Z3BzS1h0N2dENzBMUURzYnM2QzRhTmFVTkFlOE1SWlRxRVJQWFpQQ2ZfN3pkYnNqRmx2cHFzWThlTWdNNzhYRlNwQTZGQXVIQUV2NVE?oc=5,2023-10-28,Media Mention,Google News,LCDS General,2023
Hooked by the challenge of complexity of historic demographic data - Umeå universitet,Hooked by the challenge of complexity of historic demographic data  Umeå universitet,https://news.google.com/rss/articles/CBMiU0FVX3lxTE1XLUlBOS1TTHZ5OUhscThPVHJlZmFWM05YLXV2RXFzVUc0X21jZTJQNXVOQ3BuV08xdlRiZ2NxTV9rWlFtZjZNcFpSYk9VNFk5QkNj?oc=5,2023-10-17,Media Mention,Google News,Alice Reid,2023
Mention in Newsfeed,Paper discussed on newsfeed.,https://phys.org/news/2023-10-habitat-loss-pollinator-coffee-cocoa.html,2023-10-15,Impact / Social,Crossref (newsfeed),Joseph Millard,2023
Coffee and Cocoa Plants Especially at Risk From Pollinator Losses - EcoWatch,Coffee and Cocoa Plants Especially at Risk From Pollinator Losses  EcoWatch,https://news.google.com/rss/articles/CBMifkFVX3lxTE85Uy1xeXpxOXRLRFFCaF9PNkItMnUyZjNyOHNtYW1VUEVGUW5pZnJiVlR1YUNjWUZXNEFhRHpwUFJaX3o1aC1ybWN3WjRnYWxvTTNNNUUwQU0tZDdUVWZ4YmVxR2tZQ19hZFA2UG85ejIydUlRLTJvR3QyRU5hdw?oc=5,2023-10-13,Media (via Paper),Google News,Joseph Millard,2023
Key tropical crops at risk from pollinator loss due to climate change and land use - Science | AAAS,Key tropical crops at risk from pollinator loss due to climate change and land use  Science | AAAS,https://news.google.com/rss/articles/CBMiX0FVX3lxTFB3ZjhySUhJa0RPQ0xuVVFiRGxYREtuX3Y3cHZWd2staWVuY1R3QXVCMU83VUhoZDRSWmkwU0p2TkJvYkhyMEVuc25DblF6VXZxZ25zWUE4QndtNms5d3dJ?oc=5,2023-10-12,Media (via Paper),Google News,Joseph Millard,2023
Mention in Newsfeed,Paper discussed on newsfeed.,https://phys.org/news/2023-10-coffee-cocoa-pollinator-loss.html,2023-10-12,Impact / Social,Crossref (newsfeed),Joseph Millard,2023
'Explosion' reported after 'fire at waste plant' - Oxford Mail,'Explosion' reported after 'fire at waste plant'  Oxford Mail,https://news.google.com/rss/articles/CBMilgFBVV95cUxQNzBUc2IyT1l4UkM1ME9LVlV5Q280U0ttMVBReHJ6c1A1eG5lQllHWk9UaDJGNkRYaDZTTS1PWXJYVjQxODNVTW44V0FwYjV2YWJJbG1SOGhtdnlKTzhlc0h3Y3NfVG5rVE8wX0FuamZsbl9pUE5ZQTJVeUpTaGwyUFhfOUtXN0t3TDhEd01rT2U4UUh5RkE?oc=5,2023-10-02,Media Mention,Google News,LCDS General,2023
Why I’m studying… Professional Writing and Editing (PWE) - ArtsHub,Why I’m studying… Professional Writing and Editing (PWE)  ArtsHub,https://news.google.com/rss/articles/CBMitwFBVV95cUxOQ2NkbXZpRnVad0F3eER1QkZtZGUwZWRQaml6dWVMWmFra0t0bHo1cmw1X294MnQyTUFJQzZ6QmJvQ2dGSTJNaXl0MFFoYnBvM1ZhZGFFVjhzRGU2VzAtQVhCczRLZkxIbXRXMkZmRWpkVnFlazlFYnNKaEp1cW1JWTlnQ3J4UW1hS1NlcHpvTDdOa2FHeHBpZFgtbVdZYnJndTlHVEI3bThNNVFwOWwta0hPbXdMdmM?oc=5,2023-09-04,Media Mention,Google News,Alice Reid,2023
The tool that captured the global response to an unprecedented crisis - University of Oxford,The tool that captured the global response to an unprecedented crisis  University of Oxford,https://news.google.com/rss/articles/CBMijgFBVV95cUxPVkFyVTdCV2NGWGZzSXh5SGRwMzVxSnFISmNMbW5veFpkdTZrTjN3Si0zZ3BPd0NiM2g1TnZaZWNkZnYyTU5XdGp0QUg2Umw4d2YzaF93eVJwV3hFekwxWXpNaHZTQ2p3NG9WOVBuSk40ZjJpcnp6cnNqeWp5c25vSzBEanBSRm95YlMyTVpR?oc=5,2023-07-25,Media Mention,Google News,LCDS General,2023
Mention in Newsfeed,Paper discussed on newsfeed.,https://phys.org/news/2023-07-image-based-cellular-profiling-tool-peers.html,2023-07-03,Impact / Social,Crossref (newsfeed),Cecilia Lindgren,2023
Demographic transition: Why is rapid population growth a temporary phenomenon? - Our World in Data,Demographic transition: Why is rapid population growth a temporary phenomenon?  Our World in Data,https://news.google.com/rss/articles/CBMiXkFVX3lxTE5EdTBQZVoxR3l3Rmd4S2xsb0lYNko3SFMwbDJIbWx2dGxZaG8zV1d0TmFxcE80emZWQzJkTzFOaFJZc3ktWFZaWlp4NzdISkU4RjNfWUhtdzUxdkpVZ3c?oc=5,2023-06-28,Media Mention,Google News,Max Roser,2023
Mention in Newsfeed,Paper discussed on newsfeed.,https://www.news-medical.net/news/20230612/Scientists-find-clues-to-how-we-maintain-constant-blood-sugar-levels-after-meals.aspx,2023-06-12,Impact / Social,Crossref (newsfeed),Cecilia Lindgren,2023
Mention in Newsfeed,Paper discussed on newsfeed.,https://www.news-medical.net/news/20230608/DNA-study-sheds-light-on-how-we-maintain-healthy-blood-sugar-levels-after-meals.aspx,2023-06-08,Impact / Social,Crossref (newsfeed),Cecilia Lindgren,2023
How has world population growth changed over time? - Our World in Data,How has world population growth changed over time?  Our World in Data,https://news.google.com/rss/articles/CBMiZEFVX3lxTE5HcGsyeGJtcUl0Ny1SdkxIUDlXZlpybVpvbjIxMWxCcW9LTGtUenZMVC15U29HcU5uenhfeG9mLW1pRVFQZ0JNd0xGa1pTekQ4Rm85bTdHekVVbG92UE5OU0FhMVY?oc=5,2023-06-01,Media Mention,Google News,Max Roser,2023
Eight Oxford researchers become Fellows of the Academy of Medical Sciences - University of Oxford,Eight Oxford researchers become Fellows of the Academy of Medical Sciences  University of Oxford,https://news.google.com/rss/articles/CBMiowFBVV95cUxPWkVxcTRwTER4SE52RWtNU0NsQnM3WFNEd09mTW1VNUJUNVZ2NXNQYTNFbmE5eU81YXl3OWgycTJrQmdvRldWSlJLMWFWUDloR2k2XzB1N19RdXBvWVJ0MEFDSFVBSEVONjdGNkRCR1hHNmlaSDRtMnVZTFh2bm5hejNQY1I0UUZnUEREYVZDRjFBS0FPekxacnRVSGlyeGlnUDRZ?oc=5,2023-05-18,Media Mention,Google News,Cecilia Lindgren,2023
How birth year predicts exposure to gun violence - Harvard Gazette,How birth year predicts exposure to gun violence  Harvard Gazette,https://news.google.com/rss/articles/CBMinAFBVV95cUxNdDYzQ0QyQnlVZFJJV3E0elF3ZHdkOTVuWHBUNTY0T3dINGliOHhDVU1PeHcwU0dPU0J2Z0NtdnJrYVdYVkx4SG5LbTdwb2VTZTQ5R1FWMGMzVmExRmN0VEVsendaODdsYS1Udnd3eXUwU3VYT091Y0lOZzVtU2RxNmlaWDNfUURJZnJxSjRsS2FwejIzd2FuZHFHYzc?oc=5,2023-05-15,Media (via Paper),Google News,Charles Lanfear,2023
"A Comprehensive Gun Violence Analysis: Who Has Been Shot and Witnessed Shootings by Race, Sex, and Birth Year - SciTechDaily","A Comprehensive Gun Violence Analysis: Who Has Been Shot and Witnessed Shootings by Race, Sex, and Birth Year  SciTechDaily",https://news.google.com/rss/articles/CBMizAFBVV95cUxPSFUyWnNvSmpMQU9samNlOGp2WHFXSHMtRC1MYXdPQ2RQTGJOQVlGQnZQR2RkZ3lMbkNublNnTnRVcnFsdG1qYTRsLTJMUG9WTHVGOXlsSHVUOUtjdi15QkZiVFotM0FGTXU0NTlaUjk3NnYzWDZCdXdMOUk1bkF1c3pZQlprLW5kSnFrZTM5REhRcGw5bUtDQlZEa2FibFJER0dGLWl5a2tLdEJEZ3RMODlRN1ZaSnlIeEhscWhQTDd2aEFSXzJpeGJ2V2M?oc=5,2023-05-13,Media (via Paper),Google News,Charles Lanfear,2023
Landmark Study on Endometriosis Genetics Validates What Many Patients Have Experienced - Endometriosis Foundation of America,Landmark Study on Endometriosis Genetics Validates What Many Patients Have Experienced  Endometriosis Foundation of America,https://news.google.com/rss/articles/CBMisgFBVV95cUxQalpUWXNUQU4xSThrQXBMVFJ0Tllibi03LXZ5dVJYSDZJcGszMmdVMGJ4VEV0bWJWRTloVlRBZlJVT0lpSl90UTZzVUdIdDJIN054eF9rVnktYU9uN0tJSUszcE4xR2hfMlNEbHVOZEY1QzZVS1pJTXVQNEVCbThDR2lPamc0OS1qOVBfMmlyb0tjamRrNHVob3BJOF95dHJoNHpyV3ZKWG9uZjQtbDMzWEhn?oc=5,2023-05-10,Media (via Paper),Google News,Cecilia Lindgren,2023
Chilling Gun Violence Reality: 50% of Chicago Residents Witness a Shooting by Age 40 - SciTechDaily,Chilling Gun Violence Reality: 50% of Chicago Residents Witness a Shooting by Age 40  SciTechDaily,https://news.google.com/rss/articles/CBMirAFBVV95cUxPUk5TNEQtRV8yRFVTTHl1YXRqc19uRkcwUEg5OF84YUlOWmhRZ0lnMF9aZU9jbkoyOEFGVDhjMXczOUFSSDZMSTZnMFdwMTZySldJM1RDTFhIN2xWcEdsMi1zZF9QbWV2LWxZQXMtejA2b0g1cmlKMlhkUHZ4cTRESzRKMXM3bzZ4RUROZE82VmFrV3FYaHp2RmlGaXBOVmQ1Vmk1VnZYRGYzSzhN?oc=5,2023-05-09,Media (via Paper),Google News,Charles Lanfear,2023
"Long-term study pinpoints who has been shot and witnessed shootings by race, sex, and birth year - Phys.org","Long-term study pinpoints who has been shot and witnessed shootings by race, sex, and birth year  Phys.org",https://news.google.com/rss/articles/CBMieEFVX3lxTFBiaEUtRzc5VkpSbjlndW10bVJfM3lpQ2hTcGZjNlA0bUFvNzByTkthcVpZV0g4TkJaT29aQkoyMF9ablFudGU0V0t1bTJ5QVJOYlRPN0M1aHFNSkg0djRVaklGalJ0RTlVYld1WFdZTTNlTnNnTUdRQdIBd0FVX3lxTFBaTDR5VmF2d2FJZEVkNFJKaVhOZGtPMlNCNktjUkJMaUxPYnlhZGhDamF0MDgzc21ER0d4NXBtNlduZW02X2pCZ2ppSUw3cWFfbkN3U3MxaHJnNkFBT0o4ZjdFWWl6b0pveFlHdWJrMjVsZGJoRUNR?oc=5,2023-05-09,Media (via Paper),Google News,Charles Lanfear,2023
Study finds that about half of people in Chicago witness a shooting before they turn 40. - Newswise,Study finds that about half of people in Chicago witness a shooting before they turn 40.  Newswise,https://news.google.com/rss/articles/CBMivgFBVV95cUxNV21YQkt3NG5yVDhFN3ZzQUlyRngyWGYtaWNIU3hyQTZVcDdCLUtQYW00RTdPOURVSlpwM013Mk0zRjZDVGxwSVlYMlJCZTVmcXhReUpPMDlVVlVhSVB5Z1VBUnZQTlJrbHgzb2puUWplOFVaWHpmaU1Udkc5M2dLRFdjUkVTdGdxUkFRVk5rZTdxVDBkamVIckpxRFhKSUd5REZsLWljOHZILUhNSlVVN1h2cnAwWlktSXM1SC1n0gG-AUFVX3lxTE1XbVhCS3c0bnJUOEU3dnNBSXJGeDJYZi1pY0hTeHJBNlVwN0ItS1BhbTRFN085RFVKWnAzTXcyTTNGNkNUbHBJWVgyUkJlNWZxeFF5Sk8wOVVWVWFJUHlnVUFSdlBOUmtseDNvam5RamU4VVpYemZpTVR2RzkzZ0tEV2NSRVN0Z3FSQVFWTmtlN3FUMGRqZUhySnFEWEpJR3lERmwtaWM4dkgtSE1KVVU3WHZycDBaWS1JczVILWc?oc=5,2023-05-09,Media Mention,Google News,Charles Lanfear,2023
"US gun violence: half of people from Chicago witness a shooting by age 40, study suggests - University of Cambridge","US gun violence: half of people from Chicago witness a shooting by age 40, study suggests  University of Cambridge",https://news.google.com/rss/articles/CBMiwAFBVV95cUxPN0t3NXQtdmZ5bEZnd3N6UVdPQTNFREVLWkRqU1E0bm5BaFpCYkl6aWZZU293MGFIVVo0N09taU5kWnQ1TWhxWS1wUTBkYWRWS2EyS2VMLXZoMXNkdWRpZ3QwSWpJRkxaeGoxOElMckxWSmtHWWIxb09xN2JXdnNZeWUyVkozb0IwTGsxb21GNVBaeUxQVk5ZRTZVM0x0d2VfLThNTHcxal9zQ2dvMS1XMHJ4clgtUXhncmRZZHdKU2k?oc=5,2023-05-09,Media Mention,Google News,Charles Lanfear,2023
REDIM – News – We Welcome New Guest Researcher - Bundesinstitut für Bevölkerungsforschung,REDIM – News – We Welcome New Guest Researcher  Bundesinstitut für Bevölkerungsforschung,https://news.google.com/rss/articles/CBMimAFBVV95cUxQZEFHN3NfMGNNWVk1TU9xMF96Wi1ZS0RMbFlmMEFsZVQxc1FONS1jNW9HMUpzSzhxQjFrNUhDd1ZfRTBIeU51WU1mcWR3dnFqN1owWkVuV0xKZHd5VXJWS2RSUVlzc05ZWERmRTBlMG55WUNxaURwUVN0SC0yV2pnRXlfS3EwRGVtQXh6MXIxSm1tY0JCcW9yaA?oc=5,2023-05-08,Media Mention,Google News,Ilya Kashnitsky,2023
Mention in Newsfeed,Paper discussed on newsfeed.,https://phys.org/news/2023-05-tool-wikipedia-page-views-aid.html,2023-05-04,Impact / Social,Crossref (newsfeed),Joseph Millard,2023
Using social media activity to monitor and respond to population displacement in Ukraine - University of Oxford,Using social media activity to monitor and respond to population displacement in Ukraine  University of Oxford,https://news.google.com/rss/articles/CBMitwFBVV95cUxOQjBzVjBvcnM4dWgtQ2pBY212SHpNWVYybDY0RldrRjJKTDFmTXEzZmNkR3B5ckhtSGFhZzFXRC01MlgxV2QxZGJ5T0VRQVpaeE1fS29OYVMtWW9Fc2RDd0wyRjl5TGExNjRCNTdETXBKXy1hbHpxaDRhOGpUcVFVUDdJUjQ5NmJPdEdaa2pXRWVuaFlpZnppb3NnbHlQUlBKZHhVX2JVOFg4RkZrNUpuQV85MDZrVU0?oc=5,2023-04-19,Media (via Paper),Google News,Ben Elbers,2023
Global study shows the experience of endometriosis is rooted in a person’s genetics - Endometriosis.org,Global study shows the experience of endometriosis is rooted in a person’s genetics  Endometriosis.org,https://news.google.com/rss/articles/CBMiwAFBVV95cUxONzEwQUFCRTRxaGZQdDB6TmRBbF95VnY4MjkzLXVWWXdzSGtoZEUzbTQtN3lCSzNfTDFnbmM5MWNWdzVGc29uTTNuY05nM1FEemtDLUk3cFZ6ejhXRERjZ0RNVmhlejhmNXJ0YnpTb2ctWFhpVEJKemxVcjBQUlNlS3ltTWpfQV9iQjRrN1lFVWRaeFVtcEp0LU03eHVnY0QtNmFtUVRXVWlJYW5BOXk1ems4LWlSOWxWVy1PUThpSGY?oc=5,2023-04-12,Media (via Paper),Google News,Cecilia Lindgren,2023
