LCDS Mention,Summary,Link,Date Available Online,Type,Source,Name,Year
Study reveals new insights on what caused the 1920 baby boom - University of Oxford,Study reveals new insights on what caused the 1920 baby boom  University of Oxford,https://news.google.com/rss/articles/CBMilAFBVV95cUxPY0VjT2w5aHB4TU1GOXBWVGZLeFZBbzIwWFFwdkhoSFUtQkV3T2RQdkw2RzNraTc4NUNQOG5XTDVlZXlpX3d6aUtua2VqbnB5MUxjREN6YjgySVkwMEdOSFBVMjNMOWo3cHRZNXBSeEJPc1FQWHgzX3FFWGszNE82VThFNnBLYXp3VTBWOTBQQVhhUkVH?oc=5,2023-04-06,Media Mention,Google News,Hampton Gaddy,2023
Having the genetics of a night owl protects night shift workers against sleep loss - University of Oxford,Having the genetics of a night owl protects night shift workers against sleep loss  University of Oxford,https://news.google.com/rss/articles/CBMirwFBVV95cUxPSVE4R1hIWW5yQkY2MFFOVnMzYlU4dko5dVdxTzRMNG1acS1JenRCRC1yczB4ZnhTbFpHLXdId1lBOU4zMVMyVUxqY1I3bzZXa1loTGtaQWFRblV5VG1ZWkU2a0NoODhybUY5UkJYN2c5MnhqRGNlYVdwaTZ2S0xVTzd3Q21NMG9zN21zRlp1bUVHd2ROOVpzS0lUV0htZkxfMXdJZWt5ak9TYjNkQWxJ?oc=5,2023-03-17,Media Mention,Google News,Riley Taiji,2023
Having the genetics of a night owl protects night shift workers against sleep loss - University of Oxford,Having the genetics of a night owl protects night shift workers against sleep loss  University of Oxford,https://news.google.com/rss/articles/CBMirwFBVV95cUxPSVE4R1hIWW5yQkY2MFFOVnMzYlU4dko5dVdxTzRMNG1acS1JenRCRC1yczB4ZnhTbFpHLXdId1lBOU4zMVMyVUxqY1I3bzZXa1loTGtaQWFRblV5VG1ZWkU2a0NoODhybUY5UkJYN2c5MnhqRGNlYVdwaTZ2S0xVTzd3Q21NMG9zN21zRlp1bUVHd2ROOVpzS0lUV0htZkxfMXdJZWt5ak9TYjNkQWxJ?oc=5,2023-03-17,Media (via Paper),Google News,Riley Taiji,2023
Mention in Newsfeed,Paper discussed on newsfeed.,https://www.news-medical.net/news/20230313/Study-reveals-the-shared-genetic-basis-for-endometriosis-and-other-pain-conditions.aspx,2023-03-14,Impact / Social,Crossref (newsfeed),Cecilia Lindgren,2023
Largest Genetic Study of Endometriosis Identifies New Risk Factors - Technology Networks,Largest Genetic Study of Endometriosis Identifies New Risk Factors  Technology Networks,https://news.google.com/rss/articles/CBMixwFBVV95cUxQd2o2WUM2UnJkM2M4SE1DZlBzSTAwUXBUd2RVZ0VRNmRVT0htSEdScXpUTUxtSGVJRHloc0QzRkVpbS1td2UxU3hsUE1lV08zSEU5dFJGUnlFRXFOVVJNRzA2SGE2U20yQ0FncWNMZE5LSEJ5VVhVb0pjZjhNWU83OWc0QUVQejRONmtiRDVPZGkwMmZTTHhxR19CNGswRzlvbHFFbUVEakpucGxiTjllUF93VWtuOHl2TlRMT2F2TXU1MGNHXzhB?oc=5,2023-03-14,Media (via Paper),Google News,Cecilia Lindgren,2023
Global study shows the experience of Endometriosis is rooted in genetics - University of Oxford,Global study shows the experience of Endometriosis is rooted in genetics  University of Oxford,https://news.google.com/rss/articles/CBMinAFBVV95cUxPalBGVGx0eVNRNmNDempFOXdiZE9YazJYOGVlbi1aN3h6bWN5OGllZ0RSeFgxRDZPU0pINEVhaklHYlNUWnZjSmluel9MQmxZa2pSYTBaWDN0MkNzTXVyNlcyRkpXMUx0QmRGU0xoTHBGMlRTY3lCUkhFdDhYVmswcW9RYVM2RVBqVndiTm9KQU5vck9WdlhUSlJtQ2c?oc=5,2023-03-14,Media (via Paper),Google News,Cecilia Lindgren,2023
Mention in Newsfeed,Paper discussed on newsfeed.,https://exbulletin.com/world/health/2074691/,2023-03-14,Impact / Social,Crossref (newsfeed),Cecilia Lindgren,2023
Mention in Newsfeed,Paper discussed on newsfeed.,https://www.businesswire.com/news/home/20230313005215/en/Celmatix-and-Global-Collaborators-Announce-Findings-from-Largest-Genetic-Study-to-Date-on-Endometriosis,2023-03-13,Impact / Social,Crossref (newsfeed),Cecilia Lindgren,2023
Study reveals the shared genetic basis for endometriosis and other pain conditions - News-Medical,Study reveals the shared genetic basis for endometriosis and other pain conditions  News-Medical,https://news.google.com/rss/articles/CBMiygFBVV95cUxPVGdWeVFIWXRidXNkUDRCM2ZoWjlfZzBTcW9yRHNCdnV6cWMxSUExVmhOT1U2bDd0OThXMlpDZ2dxa0JhV1JfM25xOTlpQjNFSlRmZ0ZDQ2N3alNXWEV2YUZzV0w1UnBtUDNIWEcyOW9aWXdXTk8xa0FiZl9VZWpiWHdzTHBRT0g0UUR3bFFRZlpIWUxpUTFVU3FiMzN5aFY2YllmU2R5NmVGbDNzZ2NZODNfMGJkejQwTDBXeVlyeXp3QVNFWWlZVTZR?oc=5,2023-03-13,Media (via Paper),Google News,Cecilia Lindgren,2023
The genetic basis of endometriosis and comorbidity with other pain and inflammatory conditions - Nature,The genetic basis of endometriosis and comorbidity with other pain and inflammatory conditions  Nature,https://news.google.com/rss/articles/CBMiX0FVX3lxTE82R1JLT3J0di1hUERGVVRrclctM2ZCekY5MkJ4UjNXTHFjN284YXpoNkp5Skh1R0ZtaU1lVTVuQXJyT0RySDVfTkxxc2piVVF6c01kRF9ORmFJTGFmdUcw?oc=5,2023-03-13,Media (via Paper),Google News,Cecilia Lindgren,2023
Residents fear they will lose only pub in their village - Oxford Mail,Residents fear they will lose only pub in their village  Oxford Mail,https://news.google.com/rss/articles/CBMihgFBVV95cUxOUEtBZW1scFFnSDVHTFhGMnlfRHBlOGZ5UTJwTDgzTlk0VDY4amlPdG13Yk5jNDczV2JLRFloZUlIckdDMDlocTZfU05oY01CX2tmY29veHZsRWtoaGt5QWtiY1JhbEh0Y0NXbEZVbWpPZWVLWVJHaFpCYS13bXFlZjZlckJwdw?oc=5,2023-03-08,Media Mention,Google News,LCDS General,2023
Genetic variants influencing human fertility identified - new research - University of Oxford,Genetic variants influencing human fertility identified - new research  University of Oxford,https://news.google.com/rss/articles/CBMiqAFBVV95cUxQSmRzc0RKSWhKR3JsZmZBckdqS3IxQXNFeG5CQkU2LWNnZ0ZHMUhla2FNZmN3bi0zY0x5N3ljVFFWdkVnWVVNeTN5elI5VmF1RTRkdFBrWVc4SndIcFhnWjltME5iNkFZUG91aGpsS2hBRDVNQWRHalBhNzVDcjZud1JZd1BGYVZKN1MyRXhqUVRlTmlVelIzcTlCaTg2bVc5cGpfTnRLWXk?oc=5,2023-03-02,Media (via Paper),Google News,David Brazel,2023
Genome-wide analysis identifies genetic effects on reproductive success and ongoing natural selection at the FADS locus - Nature,Genome-wide analysis identifies genetic effects on reproductive success and ongoing natural selection at the FADS locus  Nature,https://news.google.com/rss/articles/CBMiX0FVX3lxTFA3ZXlvNXRSOFhoWGJaRWxfQUtsRkJRa1VvUFlxYjBEWEpGRENjMVB1VlRIQ21QM21OTEZSNkZiMDdfSXg0YnBMdUpKRlRwYmpLdG5hVDgxTDJkZC04elRr?oc=5,2023-03-02,Media (via Paper),Google News,David Brazel,2023
‘Biggest ever’ cake will be the centre-piece of community Christmas lunch - Oxford Mail,‘Biggest ever’ cake will be the centre-piece of community Christmas lunch  Oxford Mail,https://news.google.com/rss/articles/CBMimgFBVV95cUxNMTdDazhWelptZjJkM3BVeE93R2hUemt1SzRTeFFLTmRCLWZuSnU5d1BXX3E5SzdIbGFUbDJRZUI5eEVsMy1PVmZCNXFGZkE3UU1ER1B6Y29IYzlWX2hScEJCVGFWWXJBQjBaak9RaHNuTEU0WHJzMWIwM0JPOXN2WUpYZ2VVZk95UlhCRnJSelZsMDVWNlZWRDFB?oc=5,2022-12-24,Media Mention,Google News,LCDS General,2022
Considered Impossible – New Study of 5 Million People Reveals Genetic Links to Height - SciTechDaily,Considered Impossible – New Study of 5 Million People Reveals Genetic Links to Height  SciTechDaily,https://news.google.com/rss/articles/CBMirgFBVV95cUxQY2pIYzloaWx2NHhIMmJnNTNzUC0zWVpzQ3JLdDlORFpWa1dRNkF6MlRiTjV1a19SRk9OQ2NfYjJHU0NpTW9reEhUd2l3VVByR2wtZTlHdVlhQ1ByVUtmQUFpWlVBNVN4QlNpVk9rUTJhZm9nYk8wOTBwdXdoQmNpY2pwSnJvQUt1Q2k4YXRfQ2ZYOWJBTUw2cV8tZTBKM3V5QlBGSmwyZTdBNjJ3RVE?oc=5,2022-11-20,Media Mention,Google News,Cecilia Lindgren,2022
Credit Suisse’s head of India equity research Ashish Gupta resigns - BusinessLine,Credit Suisse’s head of India equity research Ashish Gupta resigns  BusinessLine,https://news.google.com/rss/articles/CBMi1wFBVV95cUxNWTVBS1RXRWl1N01WanVXNGJJeGtiUVJYdGIydVJXRUpIRWJsbmJ0Z1FZTnVjajFmMDZTRVd5ZDkweEljWUR2bVY3RFZSdkx4ZWRQQkpPNV9KTXROUktYOXV0WFlDdmdwUGlBVVdUbTBvcnlwRDFZZkx0Z3AzUC00TzNqZU45QnFoRDBiNkZFdUtHMDF5NVFYTkxISkluamxDckhadERic0NYZ3E3Zk44UWhHSFFyT3hGVDVTRlNqV2VqOHd4VFFUbjlOSU1iVzd2OEJCaGVGTdIB3gFBVV95cUxQREI4TEpWNEI2elIzNGhYX2ttZHJ4ejlLTEh1M1dKVHZTRG9hR2NIZlBRVEp0Y3ZETFNILUk2VGs2Ym9jS2FVZWUtdUE5VkZTWkM4OUdQWGY1Z1FVSXhOOWhyWmw2VXB6WmY4bHlpTEFKU1FDeDA5VW9VWlRFZFFBekhialhabk40R3ExbXNFMzhHck9ldUJoODJYSUJNTUhpeTZhVHhOejl6aXBGa2FMUUJxb2hZd3djaU80NWxJU0ttbzdndE9xVmdLLXZfNVhtdWhZeXNVZ3cyeEUwN1E?oc=5,2022-11-18,Media Mention,Google News,Aashish Gupta,2022
"COVID-19 Mobility Analysis of Statistics Estonia: Collaborating with mobile network providers during an emergency situation, measuring human mobility under social distancing measurements - Migration Data Portal","COVID-19 Mobility Analysis of Statistics Estonia: Collaborating with mobile network providers during an emergency situation, measuring human mobility under social distancing measurements  Migration Data Portal",https://news.google.com/rss/articles/CBMixAFBVV95cUxNd3hLU3U1emxzUXVjR2ZNeldqQTFkNTdSMTZEYWhidWE4R1puNC1PdkMydzk0WFZSbm1MaTJPT1lYQ1hzdGV5Tl9pR2M1cUlTVGxRQko0WFNrU2FVTEQ4T0I1VV92WDY1RExtRHlfbWxlWGp2Y2pRTkpZc0NQeW10dGtxQUJ0aUdhanVSMHV2S3Z4V21LcWo4ZmpwVU1XQ2toVkoxdzB6N0R6cUZhZXZOUTJ1Y2NiVkVOYXg4bzZDMklDbmlv?oc=5,2022-10-21,Media (via Paper),Google News,Ben Elbers,2022
What to feed garden birds - top tips for our feathered friends - Oxford Mail,What to feed garden birds - top tips for our feathered friends  Oxford Mail,https://news.google.com/rss/articles/CBMipgFBVV95cUxQd1BqQUJ5emtGdUliRW5QT0ZkS3hIWDNoaHJsaHpaZFpQZHdXYWJhRTkwSWRCMWZKTHQ4VVktbGdIV1hwZVRtTnRiNVN5Njlzd0NWQm9ncHc0YWVKLTJqOUFsT2JyU2FTXy14RnFNMmowV3JDMkJPRVJIajQ1ODFTcU5EQkdjNlVKLUNuZWhtMnJxNVFZYllCZm1mdkRVbUhiNXBnaFZn?oc=5,2022-10-17,Media Mention,Google News,LCDS General,2022
Evolution and dysfunction of human cognitive and social traits: A transcriptional regulation perspective - Cambridge University Press & Assessment,Evolution and dysfunction of human cognitive and social traits: A transcriptional regulation perspective  Cambridge University Press & Assessment,https://news.google.com/rss/articles/CBMitwJBVV95cUxQam5fRlVkdmhrZ0JFR0c2dFBrVElPaWlSQ09lZEF4X2pwbWNuMjM3U2h2a0FfZUJEekpVMnU2djlLdTU1Ui0yTks5SWxkNkFNSlBkQkhKeWJsNEhVUnJTcENHR0V2OHZqMHhtWHZIa0NzZjBiSmFmcDNPY01PZHJaM2J6bU5mRW52bGRNNzZpazBBRG5GVHV2WkowaWpuRy1wNGhST0lkR2xsZ0VWN2dwdlFzWFVrNWVGMjRiVmREQkJKa0x6NlRvQlZuVlhqVExDd0k2Yllzc19POXBmMjRQNDhGX2Fkck1nME8yMWw3Q21uQjNDZVUteFNuM0RBM2wtYmJ0RXh2d281SUxEWC10LUd0MUh6b0UzV1VjbWdwVGtHV05NX3p1N0tGUzdPZ2NKcnZJdV9ibw?oc=5,2022-09-26,Media (via Paper),Google News,Simon Myers,2022
Estimating national population through satellite data and micro-census clusters in the Democratic Republic of the Congo - Migration Data Portal,Estimating national population through satellite data and micro-census clusters in the Democratic Republic of the Congo  Migration Data Portal,https://news.google.com/rss/articles/CBMixgFBVV95cUxPUHpjS2tWdEYtd3dLc2h0ZDkzOGpfWVgwNUNtNVdiRFFYcHZ6bjN3bkxxcHpUVktWbVdEXzVzdkpFQUVwTWI0Umd3MTZCRU43c3Q2a3FUNy1CTDVjT2dGaExXYnM3YlJLc2xDMS11WGJFNEFUMEx3MjVnTUpFRzUzRnlLeHR5QjdzaEJVNUJFVzVOeVh1SzFLMXBWSFk0Z0dqR25LU2xIaVRYZmhaWElObzFCbFNqaVhLSGtxbXFOdkQwYWFFSXc?oc=5,2022-09-23,Media (via Paper),Google News,Ben Elbers,2022
Life expectancy of minorities hit hardest in the US during COVID-19 - University of Oxford,Life expectancy of minorities hit hardest in the US during COVID-19  University of Oxford,https://news.google.com/rss/articles/CBMimgFBVV95cUxNbmotT0VuUEZZUFFERU51eHh6OVZDcVlVc1RpeW9pTW5WT2ZYdHgtMkNyektsblNUU0VSUERxY29na2FpQlFld05QVjlQZDk2Z2xUaDdkUTRiUVpUR3pFcWhYZXRobUJ2MmUtQ2dfcUJjRUJrOHR1dE1NZXZOSkV3eExsbWowVVpkYVhVVkMtQUFfUlJMZkRwSTR3?oc=5,2022-08-25,Media Mention,Google News,Ginevra Floridi,2022
Drug-fuelled gang that tortured victim in 12-hour ordeal jailed for 35 YEARS - Oxford Mail,Drug-fuelled gang that tortured victim in 12-hour ordeal jailed for 35 YEARS  Oxford Mail,https://news.google.com/rss/articles/CBMitgFBVV95cUxNblZ4QXpEcFpCb3lsNHF0X1JUSlN0QzZtUGd2akVnVFFxMUJEVUtHVXVhQWxWLTBsdGF1UUUwb0hydkFWWE9GSFRLLXAwRmZxWENDNjZ0TDZpSTBZRUQ1UEEyLXU4cVV5dlU3T01DVXZEcElRUy1TMEQ3M200Rkh3OXFTTkxDVzFwN2NxUHZnREZxa3hTaDhyM0tkODNEX1JSU2hwUGNEUmlzS3dCQ3NLaHQyZjNLQQ?oc=5,2022-05-20,Media Mention,Google News,LCDS General,2022
Reply to Nepomuceno et al.: A renewed call for detailed social and demographic COVID-19 data from all countries - PNAS,Reply to Nepomuceno et al.: A renewed call for detailed social and demographic COVID-19 data from all countries  PNAS,https://news.google.com/rss/articles/CBMiXEFVX3lxTFBqdndrLTdQZ2tXSV9Id0xXbFVnOGk0emRiZFZJX3ZkaGNXZW1Cdnk2U0lpVC13dE1Oc1JjNXBnQVFsUHYtTzFFNHJUSlRPdWFlNFlnQXFXTy04bW5M?oc=5,2022-03-04,Media Mention,Google News,David Brazel,2022
Demographic science aids in understanding the spread and fatality rates of COVID-19 - PNAS,Demographic science aids in understanding the spread and fatality rates of COVID-19  PNAS,https://news.google.com/rss/articles/CBMiYkFVX3lxTE5fSDFEdlRaWGxldjUybm1VcW9ZZF9CVzZIdlVWNWJKbi1VMTRkYWUzWHBpU0IzNzlSbzM4eU1FYUFJOVVwNzEwTG5EdDVzcVlhZzZrUXhIZkUzaXVoRGR6dXNB?oc=5,2022-02-28,Media Mention,Google News,David Brazel,2022
COVID-19 certificates may boost vaccine uptake in countries with below average coverage – Oxford study - University of Oxford,COVID-19 certificates may boost vaccine uptake in countries with below average coverage – Oxford study  University of Oxford,https://news.google.com/rss/articles/CBMitwFBVV95cUxNREZCMldySnFxQ2VEOFUxVkJmZ05RSFI5Uzd1eXlJS3RBSHpIUmVhM3ladmFjZkF2MHZ2TUVod3BIcTVRMGpzRFE2ZEY4QWp2Z2o0YjhqTG03VG94cU9weUZDX3BldVJIRWpVbWFfYS1aTWJJMnVnSzhaeDJTM0NYR0dzRTRid0x2WlpfallnTnFMS0pXQ1J4Tk1nbDhuT3lFMmZYUnRTWXBaRFhxeTVqRXpSa3FHQ3M?oc=5,2021-12-14,Media Mention,Google News,Tobias Rüttenauer,2021
COVID vaccination requirements may successfully increase vaccination rates: Study - ABC News,COVID vaccination requirements may successfully increase vaccination rates: Study  ABC News,https://news.google.com/rss/articles/CBMipAFBVV95cUxON3ZpanNVenEwM1NKLU1zTDF5NHE5Q1ZNNXNfNG5sbDZHRDFPdGFCLTBRWWtxWXlyUzEyTUJrcTdMRGZKYm4wVW12Um5leEc4cGliUWdvelg4cUZIcW9wQ0xWOHhBX0VHWUoyeDBGYlNKNzdQY0FILVV4OEtlX2NGMkk2MFFBUU1DSGFWelRuZVRtZUVmY3Q4WU1ILXl1MUdQWkVGedIBqgFBVV95cUxPVU9PemFESE0tTzZyd0dBUDRWRm5Tb1VLelNiTFpqTTdIMXpndFpjMFo2YXI0RnFHck5HRXRlM09USW9vVXFHODd5dHY0MjI5bVJ4US1DQS1vR0djYWFWLVJ1alYtR1ZSRll5dkJ6SVZYcEdCNWxvRHNVNFdOQ3M4MGRSWkRQTmtEV0UtTVU0YlRPNkVFajVaSmRPQ3hOYkd0czN1ZFdIcVdGQQ?oc=5,2021-12-13,Media Mention,Google News,Tobias Rüttenauer,2021
Estimating direct and indirect genetic effects on offspring phenotypes using genome-wide summary results data - Nature,Estimating direct and indirect genetic effects on offspring phenotypes using genome-wide summary results data  Nature,https://news.google.com/rss/articles/CBMiX0FVX3lxTE5qVVB3bTBldC02a3Zad0hjVjNXWXhWbTZ0SFpqR2xyUXk0QkpBVUlmT2ViTHNKRHlubUZpS0haaTlZbTlaWVpEajNqcEN2WjQ5SDdub2Ntdk9MWTU2LVQ0?oc=5,2021-09-14,Media (via Paper),Google News,David Brazel,2021
Urine peptidome analysis in cardiorenal syndrome reflects molecular processes - Nature,Urine peptidome analysis in cardiorenal syndrome reflects molecular processes  Nature,https://news.google.com/rss/articles/CBMiX0FVX3lxTE9rNDBwb2tpQ1BEZkZiV0FYYVBXNTAxRktaZ2hBVzU1T012X29TZkQ0dWkxVV9ocmJMd1NZUTBEeWNXTnhzUTladkVjWmFrNW00clhha242NWtyV2tkb19r?oc=5,2021-08-10,Media (via Paper),Google News,Bo Zhao,2021
College faced with ‘financial challenges’ joins London university - Oxford Mail,College faced with ‘financial challenges’ joins London university  Oxford Mail,https://news.google.com/rss/articles/CBMimwFBVV95cUxOTFdldm84QjREMk1URy1IZENEUmFOb1dyTkJ0YkVsMm93em1PekNDRHhhdnVUalhUeS1WckhKdjBBZXF4azNfS2ExSDlRMW9tMm52RHg2OGR3ZnBCLUpCVTV6b1dXSHN6Mmg0bTBxdUNpTk45Smk3amRnbXhRSjZRTWFsbVFDYURwRGpuV29JRzhubXNWaGp4THNvbw?oc=5,2021-08-03,Media Mention,Google News,LCDS General,2021
UNHCR’s “Winter Cell”: Forecasting migration flows with weather data - Migration Data Portal,UNHCR’s “Winter Cell”: Forecasting migration flows with weather data  Migration Data Portal,https://news.google.com/rss/articles/CBMilwFBVV95cUxQdjJycTk2YktRX3ZubENmaWNOcFlJQ3d2NGR2cEFfbTYtNS12MWVKNmdsdlBrYW9UVld2Zjl5czE3Q19Qd2RSdXNlQ19xTzBwMnZ6ajRUVDJzWFdlMnZSWnlvbjFLTkN1eHhUZ1djR2RQNW5aODNSTUpOSGlVODJld1Qwb1U2UENGMDJlUk56WFBPQmJfbmtJ?oc=5,2021-05-27,Media (via Paper),Google News,Ben Elbers,2021
Fellowship winners will study next at Oxford and Cambridge - YaleNews,Fellowship winners will study next at Oxford and Cambridge  YaleNews,https://news.google.com/rss/articles/CBMikgFBVV95cUxQTGRoYWNVakxFdWhZcXdiZXk2Nl96c0Ribmh6U0ZnYmVWcFYzYzBsVHZFRERST2hlYzJ3RHh5NVNVa2lSOXg1bk91YlBmUFNlenZsMVZVdTROVGtFb1VEdmR3dVpQdVNEMmNBVk1kSV91TEdrMlNiM3gxS2NyNzA5WkFVUTFoZUZnVXJtdWs2YXBaUQ?oc=5,2021-05-11,Media Mention,Google News,Maria Gargiulo,2021
Covid-19 and Indian Exceptionalism - The India Forum,Covid-19 and Indian Exceptionalism  The India Forum,https://news.google.com/rss/articles/CBMie0FVX3lxTE1wU0NtU2lQMXlhR09QX3F1Y09QcWtEMWstLTVWREw2TzJnWmdHaDk4ek5KTUZFZ21GWnVyZlBPYVhDdjluelI2cndpLWphbDkxVEZsU0hoenhvNi1fNVdXY2xOclJqNHRsLWJ1clYxc05iQ1dGb1RVRlBuMA?oc=5,2021-05-11,Media (via Paper),Google News,Aashish Gupta,2021
"Children learned ‘little or nothing’ during school closures, despite online learning - University of Oxford","Children learned ‘little or nothing’ during school closures, despite online learning  University of Oxford",https://news.google.com/rss/articles/CBMiugFBVV95cUxPNXhSalhsZTI1b2NXa0NpYmJKUlZBcEEtcGYzWE1xY3NjaWNpT3ZZVWdhWFU2bVBkOW1ENXRDcHVRZl9hMzVCME0tdzBRd0RPcFNQNGxucmVUMlhhWGxYSG1ReFdVbEVtLW1xN1NEbWVINlFLa0dzbk1QcEpSSUVENTZVZEhwNUttbTI5Um5KY3FUZ3JMNS16LVF1VTc2cXlvZURuTl9ScXZjUlRzclNzazFqZTFxbWxQVEE?oc=5,2021-04-08,Media Mention,Google News,Mark Verhagen,2021
Beam us up! Elsevier pulls 26 Covid-19 papers by researcher with a penchant for Star Trek - Retraction Watch,Beam us up! Elsevier pulls 26 Covid-19 papers by researcher with a penchant for Star Trek  Retraction Watch,https://news.google.com/rss/articles/CBMixwFBVV95cUxOMHQ1cUpkZlI5TnA3eGpua182YXJVd2wtLV91N1k4OVdiNzdNVUF1cDg4MGxMR1ZiVDZ4elE0eHBfeUJRemh2dllSWEU0Z1lfOFRwdW1xRFhuMkl3Q3N4UE5IMWpIR19xZnVib1k1ejJqWFVldEUtVy1SWDgyVDZXVmpuTmJkY25Va01HS0VSaE1XS192SENXTHJ1YXJWNmZrOU9OTm8tMlpHdFB2S0NBRWlJMFFKYlNfQzktWFpwRXc0Y1VNclUw?oc=5,2021-03-31,Media Mention,Google News,Hampton Gaddy,2021
Oxford dashboard highlights potential future COVID-19 virus hotspots - University of Oxford,Oxford dashboard highlights potential future COVID-19 virus hotspots  University of Oxford,https://news.google.com/rss/articles/CBMiqAFBVV95cUxNUTM4T01uMTU0SlhfbklTUGlMYWFZOE5Fb0dPMkVBcWNQU3RjaE02UkFveVZLbmVnYU9pZ3VOT3pRZ2t6NnJVUG51OVhxeTM4VXhfdnlEcUxSakt1dUVPMVVIWGJRV1YxTF9FbXh6UlhndG1wN1RsaXhISU1fV1dkRHlKVC1BdE1pNWVBX1lSN0VTNzFwQmlEY0xmTk54ME00a2Z6S3BCTjA?oc=5,2020-06-29,Media Mention,Google News,Mark Verhagen,2020
‘What Covid-19 Means To Us’ - The India Forum,‘What Covid-19 Means To Us’  The India Forum,https://news.google.com/rss/articles/CBMia0FVX3lxTE9qdVhkcFdGQzJlU2lfczlIN2tQakVhWkFHaHRSakVOMkRWLXJrN3BWcjlYSzI1T2xkZE8xbFJYVEZtYmlybWx5ZG1iUEZIcWhEVHZjZ1dlSmttZTcwYVpLbFVvUER1dTFyMlFr?oc=5,2020-04-06,Media (via Paper),Google News,Aashish Gupta,2020
Circulating miRNA-21 as a diagnostic biomarker in elderly patients with type 2 cardiorenal syndrome - Nature,Circulating miRNA-21 as a diagnostic biomarker in elderly patients with type 2 cardiorenal syndrome  Nature,https://news.google.com/rss/articles/CBMiX0FVX3lxTFBaenZfMFlpU25mT1VReWJET0gxd3lLbGlWZUZkMXE3YXcxMGVJMTg1U3FHVXh2Vms5OFBMb0duVFJBMXpHVTZpMHdVV3habkdLNjZhQ0dkbVktV3VJQnBn?oc=5,2020-03-17,Media (via Paper),Google News,Bo Zhao,2020
Characteristics of Patent Ductus Arteriosus in Congenital Rubella Syndrome - Nature,Characteristics of Patent Ductus Arteriosus in Congenital Rubella Syndrome  Nature,https://news.google.com/rss/articles/CBMiX0FVX3lxTFBTSVVQdlo3eWQ3QUJEdE1TV0R1VUVPM2ZHVURTTWEtRUVvZ3NHaDBfTDZjcHptcTZRYnRDcE9FcGRfZ1gtMEhLTnZCY3pITzdNdjhJS09YYUwxZkhNQVJ3?oc=5,2019-11-19,Media (via Paper),Google News,Bo Zhao,2019
The world map redrawn according to country populations (Credit: Max Roser for Our World in Data) - Devpolicy Blog from the Development Policy Centre,The world map redrawn according to country populations (Credit: Max Roser for Our World in Data)  Devpolicy Blog from the Development Policy Centre,https://news.google.com/rss/articles/CBMi2wFBVV95cUxORzl5LUlobURleERHaHhjTEU2Q090UnpybUVMQnAxdHYyVXNyU3pNVlJweTlDbWZWbjg5N1RKUFpFaDBRMzNyc1U2NVczTmxQc1ZUY1gxSU1Xd2NGVjRtT2s0RmV2clVoUWk0VXNCRC1oS0I1Y3d3anM4SnZRUE93U2NPRlliMjE0cHBfTUtRMmxrLVlUX1pMRndxeWlFSEhya25VNkg4V3RJZGx2dVdwb3ZZdkRmbm9WQlBHRVlWbVFjNl9qbjE0YmxhYm5CU1Ric3d4a0J0TXlQYUE?oc=5,2019-09-27,Media Mention,Google News,Max Roser,2019
"Population momentum: if the number of children per woman is falling, why is the population still increasing? - Our World in Data","Population momentum: if the number of children per woman is falling, why is the population still increasing?  Our World in Data",https://news.google.com/rss/articles/CBMiWkFVX3lxTE4zU1ZaUW9tb2ZmQ2c5RkNZZlBVTkpabHlDNEU2VWg0aThjaXhZZXBCVDdxOHhUdTd4VUI5U3FEOWU0Z0xBT29MZHh5RHBtbWN5bTJPRGFrQTRCQQ?oc=5,2019-06-02,Media Mention,Google News,Max Roser,2019
Researchers discover DNA variants significantly influence body fat distribution - The University of North Carolina at Chapel Hill,Researchers discover DNA variants significantly influence body fat distribution  The University of North Carolina at Chapel Hill,https://news.google.com/rss/articles/CBMiuAFBVV95cUxNdUVXU00xUDBtaUp4Ml9BY0RaR0M5YmRLb3ZHQVI5eV9JNW4wWVZCYlI3YXhybi1DTHlGbnlwNUVGMlFmMURxMUZ0ajE0NUJKT05XeVNhMExZckJjdkdhTXBhbDd4TU4yeE12RWNBTXNqVE5CTzJDOFM0LTh0dWZUcVNaRnkwOWhReHNiTWZVR2RhZjItdFhSMlQ4blNnZ0REd2VKdUx3R1pkWXNYa1F1X1lZWTVlalhQ?oc=5,2019-02-22,Media Mention,Google News,Cecilia Lindgren,2019
Researchers discover variants in DNA that significantly influence how the body distributes fat - UNC Gillings School of Global Public Health,Researchers discover variants in DNA that significantly influence how the body distributes fat  UNC Gillings School of Global Public Health,https://news.google.com/rss/articles/CBMiwgFBVV95cUxQYklRdDhrMGI2MXY3T2JxclptcWppTHN6ZW16UjNYNWZHN2tRZDBNTm1BLTRHV1V2enZwN2dvVktqVzJrQ21wYm9xQkNzMXZhMm1zaXBtY055QVdqbWtPY0pXbGh3dVNNNko2d2dpXzFBb3RCcG83OHBJOWJ5bnVEa2ZNbW5jNC1tb01HRURFWHZRbUdSU3VuaW9YWWdFZEdSal8xVlp1ZW1GZ2YzSkZTZWJiTVBYR0VaSU5KWWdKLXRfUQ?oc=5,2019-02-18,Media Mention,Google News,Cecilia Lindgren,2019
Map reveals Europe’s population crisis with Western countries ageing younger populations in the east - Daily Mail,Map reveals Europe’s population crisis with Western countries ageing younger populations in the east  Daily Mail,https://news.google.com/rss/articles/CBMi2AFBVV95cUxPS2FhLTB0Q21tOVNHVHhtVUdxX3d3dlBodU1Ob0ZNV3RrWkE0WU5fVlVWaG83TWZyOVI2NUx5SkJfcGxhTFNIRnVxVm5ZaFRKVkxVMXNJUl9JdHR3eWhjSDlxdUttendUV0JXeGItejRmMDFvUDg1SjVMVmtERkhRQlBVWFdkT3RPUVdaWmxNQXAzdGM0WFNzR0E2aVI0QTNsc0ZjajNwb0sxNTM0UTlWZEJxODRNaWo1cFh5OXUzUUNfaFdZWjRzWGdvbXVFbnhFcDJDTkxPX3fSAd4BQVVfeXFMUElpU01rbWp2LURiY1Z5blY5bjVtNWQ3bTN6Zi0zQlBCX1lwS1d6b0JybmNLVkxRRm9iYWpFaUxINUJCdm5QZzJZZFJzclBuVkY3aGpaa2xLMHROcnp2dFBranVsRERXVVlJRHU1Z2tMS1lRazFvci1nZUk5WmlSd0RqdVVKQ0JUTkVBRl9Tbm1oVzYxX3cwLXBPYjlCODQ2WEpZVV9ZQmZGTndQLTdjTEJkYWMyZ2hlcVZDSEtCQi1TMU1vVU0xT2RLNWtMY2ppNlNrdFBlZFY0UGhfelln?oc=5,2018-07-24,Media Mention,Google News,Ilya Kashnitsky,2018
Regional population structures at a glance - The Lancet,Regional population structures at a glance  The Lancet,https://news.google.com/rss/articles/CBMiiwFBVV95cUxNOUNfbzRiUV8zSkItcmx5d1FzeThjZkcwcVA1Q1ZpZi1uN3VoTW80ZHR6V29MV0RhaC1aUG1aZnE0LTZYbUxsM2ZvbmU5YmtsY2pZS2E3WkVYOXp4RW95MzRZRDBIZWVxNVZxdFFmcHRzczNlYVgwVzVqWVBzNENuVjFnMzFEY3ZyS244?oc=5,2018-07-21,Media Mention,Google News,Ilya Kashnitsky,2018
N-Acetylcysteine Attenuates the Development of Renal Fibrosis in Transgenic Mice with Dilated Cardiomyopathy - Nature,N-Acetylcysteine Attenuates the Development of Renal Fibrosis in Transgenic Mice with Dilated Cardiomyopathy  Nature,https://news.google.com/rss/articles/CBMiX0FVX3lxTFBaenZScm9faGYyNzhIUmNXVEVwZjVEal9lcXB2cnhtY0c0V1hZeXItMFhhT2YtcFhoQUYzTE5hU1NOX1llYTBpY1pqRGIyTVhxeFlXQ1JnRjhJMEtaUkM0?oc=5,2017-12-18,Media (via Paper),Google News,Bo Zhao,2017
Mouse embryonic stem cells have increased capacity for replication fork restart driven by the specific Filia-Floped protein complex | Cell Research - Nature,Mouse embryonic stem cells have increased capacity for replication fork restart driven by the specific Filia-Floped protein complex | Cell Research  Nature,https://news.google.com/rss/articles/CBMiU0FVX3lxTE9kbzhqQXlkRTRBZ09rM3RoWEFLSEdnU2M2YVVoUTJUMTVSb3RVc2pXTVB2REZEXzlmaXI5QklrakhUNEI4Z1hJR2VZNHFCN2Jlb01v?oc=5,2017-11-10,Media Mention,Google News,Bo Zhao,2017
Max Roser - University of Oxford,Max Roser  University of Oxford,https://news.google.com/rss/articles/CBMihwFBVV95cUxNNFNPX1JPQnZXaWJvQXZmbkJtU21WbGpLU3c2Y1JZOVR5cEU2ODJfYlhjMHFGajNiV0NDdERiRDd3REpnaFRJQ2RKRHFJTTA5czREWFVETE5sTndSVnRVM0tBU1gyb0VzX3dBZkVUQVRVQ3UwNWNxQWx5bG5ZbEwycG54dFBkNHM?oc=5,2017-05-30,Media Mention,Google News,Max Roser,2017
"'Desperate' drug dealer sold cannabis to feed child, court hears - Oxford Mail","'Desperate' drug dealer sold cannabis to feed child, court hears  Oxford Mail",https://news.google.com/rss/articles/CBMirgFBVV95cUxNb2RadDd1c0dVck52OGpRVjlBRXZpelhXVi1PaEhwRVVkaGhTZGtQME1WdEU5U2xqRVRCZy1NSE5YalVIQkNJNi1Xekt4ZEk4M2hUMUl1Q2ZKT0N5N20zQ1N5ZTVMMkI4LUR0UXhZcTVMMVVWTEJ1NVIyXzB3M1FnOVZxUDBuNU5oNFM0TUg4VC1rMlJVR2lCcGY3NlhERlpMbTNLUmJNX3pMWlpTRnc?oc=5,2017-02-24,Media Mention,Google News,LCDS General,2017
Seeing human lives in spreadsheets: The work of Hans Rosling (1948–2017) - oxfordmartin.ox.ac.uk,Seeing human lives in spreadsheets: The work of Hans Rosling (1948–2017)  oxfordmartin.ox.ac.uk,https://news.google.com/rss/articles/CBMirAFBVV95cUxNQ3JoM3dDelluTGpWakcyTDY1ZHAxblJPbmxuSXNCZU9IdzJBLXFOQU1zUnA1ZzhKdlY3VE5VSV8xZDZIaHI0RFQ1VnctcW5LaE1wdVdPVHJLTzdudERYVkRJdHJYR1FNVHJJTGtETk5mN0RCYzA3RW5oaVNBdjRpNlZ1VVN1MHRpQWNRclgzdFE4ekd4TE40M1pYSE5rSW9pRFo1T0NSejRuOUlX?oc=5,2017-02-16,Media Mention,Google News,Max Roser,2017
